Drug_Name,Interactions
Etanercept,"Pimecrolimus, Trastuzumab, Abatacept, Rabies virus inactivated antigen, A, Belimumab, Infliximab, Sipuleucel-T, Vedolizumab, Denosumab, Tocilizumab, Tofacitinib, Anakinra, Leflunomide, Canakinumab, Cyclophosphamide, Natalizumab, Rilonacept, Certolizumab pegol, Roflumilast, Tacrolimus"
Bivalirudin,"Ibrutinib, Edoxaban, Tenecteplase, Rivaroxaban, Treprostinil, Nintedanib, Warfarin, Fondaparinux, Acetylsalicylic acid, Edetic acid, Tositumomab, Obinutuzumab, Heparin, Enoxaparin, Ridogrel, Vitamin E, Dasatinib, Phenindione, Urokinase, Streptokinase, Acenocoumarol, Deoxycholic acid, Tibolone, Dabigatran etexilate, Dalteparin, Tipranavir, Chlorotrianisene, Omacetaxine mepesuccinate, Citric acid, Infliximab, Progesterone, Pentosan polysulfate, Phenprocoumon, Desogestrel, Deferasirox, Apixaban, Dydrogesterone, Reteplase, Gestodene, Sulodexide, Vorapaxar, Anistreplase, Sugammadex, Ethyl biscoumacetate, Limaprost, Abciximab, Omega-3 fatty acids, Ibritumomab tiuxetan, Alteplase, Dicoumarol"
Leuprolide,"Tolbutamide, Pentamidine, Linagliptin, Protriptyline, Bromocriptine, Sulfisoxazole, Ezogabine, Haloperidol, Insulin degludec, Atomoxetine, Famotidine, Insulin aspart, Metoclopramide, Felbamate, Paliperidone, Iloperidone, Gadobenic acid, Mirtazapine, Venlafaxine, Panobinostat, Escitalopram, Fosphenytoin, Eliglustat, Metformin, Tamoxifen, Tizanidine, Mirabegron, Olanzapine, Repaglinide, Promethazine, Ofloxacin, Imipramine, Citalopram, Bedaquiline, Domperidone, Lopinavir, Albiglutide, Foscarnet, Rosiglitazone, Gliquidone, Desflurane, Dronedarone, Mifepristone, Amitriptyline, Acetohexamide, Propafenone, Granisetron, Empagliflozin, Nilotinib, Telavancin, Sotalol, Ciprofloxacin, Sunitinib, Triptorelin, Insulin lispro, Thioridazine, Glipizide, Vorinostat, Pasireotide, Acarbose, Dofetilide, Fluoxetine, Lumefantrine, Cisapride, Atazanavir, Ibandronate, Dasatinib, Saxagliptin, Dabrafenib, Miglitol, Bosutinib, Degarelix, Nelfinavir, Primaquine, Chloroquine, Nicardipine, Terbutaline, Crizotinib, Trimethoprim, Quetiapine, Trimipramine, Insulin glulisine, Insulin detemir, Trazodone, Solifenacin, Vandetanib, Isoflurane, Nortriptyline, Olodaterol, Insulin human, Chlorpropamide, Exenatide, Bortezomib, Itraconazole, Ritonavir, Ranolazine, Glimepiride, Risperidone, Flecainide, Glyburide, Indacaterol, Fingolimod, Tolazamide, Flupentixol, Salmeterol, Thiothixene, Disopyramide, Methotrimeprazine, Nateglinide, Arsenic trioxide, Galantamine, Sevoflurane, Desipramine, Treprostinil, Posaconazole, Indapamide, Asenapine, Mefloquine, Ziprasidone, Tacrolimus, Liraglutide, Lithium cation, Ketoconazole, Maprotiline, Ibutilide, Goserelin, Toremifene, Gliclazide, Ceritinib, Norfloxacin, Octreotide, Tolterodine, Metronidazole, Methadone, Doxepin, Clarithromycin, Levofloxacin, Procainamide, Sorafenib, Amoxapine, Paroxetine, Quinine, Canagliflozin, Alogliptin, Rilpivirine, Pramlintide, Lenvatinib, Tetrabenazine, Choline C 11, Osimertinib, Dolasetron, Fluticasone propionate, Aripiprazole, Alfuzosin, Lapatinib, Erythromycin, Sertraline, Perflutren, Pioglitazone, Amantadine, Isradipine, Hydroxyzine, Sulfamethoxazole, Ondansetron, Dapagliflozin, Buserelin, Moexipril, Eribulin, Oxytocin, Corifollitropin alfa, Sitagliptin, Chlorpromazine, Propofol, Arformoterol, Quinidine, Pimozide, Diphenhydramine, Ivabradine, Anagrelide, Clomipramine, Dulaglutide, Histrelin, Pazopanib, Moxifloxacin, Clozapine, Amiodarone, Droperidol, Vildagliptin, Voriconazole, Vemurafenib, Apomorphine, Artemether, Formoterol, Salbutamol, Vilanterol, Fluconazole, Insulin glargine, Saquinavir, Promazine, Vardenafil, Gemifloxacin, Capromab pendetide, Telithromycin, Zuclopenthixol, Azithromycin"
Peginterferon alfa-2a,"Clozapine, Metamizole, Tizanidine, Aldesleukin, Theophylline, Aminophylline, Methadone, Telbivudine, Ribavirin, Pegloticase, Zidovudine"
Alteplase,"Fenoprofen, Salsalate, Naproxen, Cilostazol, Epoprostenol, Dalteparin, Desvenlafaxine, Citalopram, Floctafenine, Apixaban, Desirudin, Warfarin, Treprostinil, Flurbiprofen, Abciximab, Nadroparin, Limaprost, Eptifibatide, Aprotinin, Sulindac, Heparin, Cangrelor, Edoxaban, Oxaprozin, Anagrelide, Dabigatran etexilate, Sulodexide, Magnesium salicylate, Acenocoumarol, Levomilnacipran, Vorapaxar, Venlafaxine, Ketorolac, Phenindione, Fondaparinux, Iloprost, Danaparoid, Edetic acid, Fluvoxamine, Vortioxetine, Ticagrelor, Piroxicam, Dipyridamole, Tiaprofenic acid, Ibuprofen, Etodolac, Prasugrel, Nitroglycerin, Milnacipran, Enoxaparin, Acetylsalicylic acid, Tirofiban, Ethyl biscoumacetate, Sertraline, Aminosalicylic acid, Diclofenac, Caffeine, Phenprocoumon, Bismuth subsalicylate, Mefenamic acid, Clopidogrel, Tolmetin, Argatroban, Indomethacin, Meloxicam, Diflunisal, Ketoprofen, Paroxetine, Fluoxetine, Citric acid, Tinzaparin, Rivaroxaban, Escitalopram, Ticlopidine, Nabumetone, Duloxetine, Dihydrocodeine, Vilazodone, Dicoumarol"
Darbepoetin alfa,"Thalidomide, Nandrolone phenpropionate, Lenalidomide"
Urokinase,"Clopidogrel, Indomethacin, Oxaprozin, Cilostazol, Prasugrel, Dabigatran etexilate, Diclofenac, Anagrelide, Floctafenine, Apixaban, Acetylsalicylic acid, Magnesium salicylate, Nabumetone, Ticagrelor, Fluvoxamine, Vortioxetine, Epoprostenol, Fenoprofen, Vilazodone, Nadroparin, Aminosalicylic acid, Eptifibatide, Acenocoumarol, Piroxicam, Caffeine, Dipyridamole, Tiaprofenic acid, Iloprost, Argatroban, Paroxetine, Ketorolac, Salsalate, Dalteparin, Diflunisal, Aprotinin, Mefenamic acid, Ticlopidine, Tirofiban, Milnacipran, Desirudin, Ketoprofen, Edoxaban, Levomilnacipran, Enoxaparin, Rivaroxaban, Fluoxetine, Flurbiprofen, Duloxetine, Dihydrocodeine, Abciximab, Cangrelor, Venlafaxine, Treprostinil, Bismuth subsalicylate, Danaparoid, Naproxen, Tolmetin, Tinzaparin, Sertraline, Fondaparinux, Ibuprofen, Warfarin, Citalopram, Heparin, Etodolac, Desvenlafaxine, Escitalopram, Sulindac, Meloxicam, Vorapaxar"
Goserelin,"Dofetilide, Lopinavir, Paroxetine, Bortezomib, Desflurane, Propafenone, Lithium cation, Vardenafil, Promazine, Dolasetron, Ofloxacin, Granisetron, Galantamine, Salbutamol, Ivabradine, Famotidine, Trimipramine, Oxytocin, Atazanavir, Eribulin, Mifepristone, Clarithromycin, Metoclopramide, Vandetanib, Metformin, Ranolazine, Ciprofloxacin, Perflutren, Gliquidone, Arsenic trioxide, Rilpivirine, Alogliptin, Paliperidone, Lapatinib, Insulin detemir, Moexipril, Sulfisoxazole, Felbamate, Chlorpropamide, Trimethoprim, Lenvatinib, Sorafenib, Flecainide, Nelfinavir, Citalopram, Glyburide, Foscarnet, Chlorpromazine, Insulin human, Corifollitropin alfa, Methadone, Alfuzosin, Sunitinib, Primaquine, Flupentixol, Arformoterol, Solifenacin, Hydroxyzine, Voriconazole, Mirtazapine, Osimertinib, Isoflurane, Crizotinib, Desipramine, Haloperidol, Ziprasidone, Anagrelide, Propofol, Fluconazole, Olodaterol, Choline C 11, Nilotinib, Erythromycin, Ketoconazole, Octreotide, Saquinavir, Insulin glargine, Acetohexamide, Nicardipine, Telithromycin, Formoterol, Indapamide, Apomorphine, Histrelin, Escitalopram, Metronidazole, Isradipine, Fluoxetine, Vildagliptin, Vorinostat, Norfloxacin, Protriptyline, Treprostinil, Fingolimod, Amantadine, Procainamide, Amiodarone, Levofloxacin, Olanzapine, Zuclopenthixol, Dasatinib, Gadobenic acid, Degarelix, Asenapine, Pimozide, Diphenhydramine, Tolterodine, Tetrabenazine, Chloroquine, Dabrafenib, Fluticasone propionate, Insulin glulisine, Ezogabine, Triptorelin, Sotalol, Ritonavir, Artemether, Ondansetron, Capromab pendetide, Ibandronate, Bosutinib, Quinine, Buserelin, Amoxapine, Panobinostat, Pasireotide, Fosphenytoin, Amitriptyline, Droperidol, Gliclazide, Salmeterol, Saxagliptin, Vemurafenib, Disopyramide, Imipramine, Doxepin, Ibutilide, Clozapine, Terbutaline, Thiothixene, Toremifene, Cisapride, Thioridazine, Dronedarone, Promethazine, Glimepiride, Linagliptin, Repaglinide, Indacaterol, Maprotiline, Sertraline, Lumefantrine, Insulin aspart, Azithromycin, Risperidone, Venlafaxine, Nortriptyline, Eliglustat, Vilanterol, Telavancin, Methotrimeprazine, Bedaquiline, Sulfamethoxazole, Pentamidine, Mirabegron, Iloperidone, Sevoflurane, Gemifloxacin, Moxifloxacin, Tolbutamide, Quinidine, Ceritinib, Trazodone, Posaconazole, Clomipramine, Domperidone, Canagliflozin, Tizanidine, Insulin lispro, Atomoxetine, Quetiapine, Pazopanib, Mefloquine, Tacrolimus, Tamoxifen, Itraconazole, Aripiprazole"
Reteplase,"Ethyl biscoumacetate, Levomilnacipran, Ketoprofen, Escitalopram, Aminosalicylic acid, Meloxicam, Enoxaparin, Bismuth subsalicylate, Apixaban, Ticagrelor, Floctafenine, Phenprocoumon, Tirofiban, Venlafaxine, Treprostinil, Rivaroxaban, Ticlopidine, Duloxetine, Piroxicam, Desirudin, Edoxaban, Dabigatran etexilate, Mefenamic acid, Desvenlafaxine, Tolmetin, Fluvoxamine, Diclofenac, Vilazodone, Fondaparinux, Acetylsalicylic acid, Iloprost, Anagrelide, Nadroparin, Prasugrel, Diflunisal, Etodolac, Milnacipran, Sertraline, Dihydrocodeine, Argatroban, Salsalate, Danaparoid, Phenindione, Edetic acid, Sulindac, Dipyridamole, Clopidogrel, Flurbiprofen, Ibuprofen, Fluoxetine, Citalopram, Eptifibatide, Vorapaxar, Warfarin, Tiaprofenic acid, Abciximab, Nabumetone, Dicoumarol, Indomethacin, Magnesium salicylate, Acenocoumarol, Fenoprofen, Heparin, Limaprost, Citric acid, Cilostazol, Caffeine, Cangrelor, Oxaprozin, Sulodexide, Naproxen, Dalteparin, Epoprostenol, Tinzaparin, Paroxetine, Ketorolac, Vortioxetine, Aprotinin"
Erythropoietin,"Thalidomide, Lenalidomide, Nandrolone phenpropionate"
Salmon calcitonin,"Lithium cation, Zoledronic acid"
Interferon alfa-n3,"Methadone, Zidovudine, Clozapine, Metamizole, Theophylline, Aldesleukin, Ribavirin"
Pegfilgrastim,Pegloticase
Sargramostim,"Bleomycin, Cyclophosphamide"
Secretin,"Dicyclomine, Cyclobenzaprine, Loxapine, Benzatropine, Pizotifen, Oxybutynin, Methscopolamine, Cyclopentolate, Trimipramine, Methotrimeprazine, Cetirizine, Moclobemide, Dexchlorpheniramine maleate, Cyproheptadine, Haloperidol, Clemastine, Quetiapine, Amoxapine, Promazine, Promethazine, Levocetirizine, Procyclidine, Olopatadine, Protriptyline, Dimenhydrinate, Fesoterodine, Azelastine, Fluphenazine, Glycopyrronium, Imipramine, Aclidinium, Ipratropium, Tranylcypromine, Levocabastine, Trimethobenzamide, Darifenacin, Chlorpheniramine, Carbinoxamine, Tolterodine, Orphenadrine, Maprotiline, Thiothixene, Doxepin, Droperidol, Desloratadine, Nortriptyline, Perphenazine, Loratadine, Zuclopenthixol, Clomipramine, Pimozide, Trihexyphenidyl, Isocarboxazid, Butylscopolamine, Fexofenadine, Brompheniramine, Thioridazine, Hydroxyzine, Mepenzolate, Tiotropium, Hyoscyamine, Cyclizine, Flavoxate, Prochlorperazine, Propantheline, Meclizine, Trospium, Amitriptyline, Chlorpromazine, Solifenacin, Scopolamine, Homatropine, Desipramine, Triprolidine, Risperidone, Atropine, Flupentixol, Diphenhydramine, Phenelzine, Umeclidinium, Olanzapine, Clozapine, Doxylamine, Trifluoperazine, Disopyramide"
Peginterferon alfa-2b,"Gefitinib, Atomoxetine, Pipotiazine, Zuclopenthixol, Nefazodone, Aldesleukin, Risperidone, Promethazine, Eliglustat, Cyclobenzaprine, Chlorpheniramine, Clozapine, Procainamide, Protriptyline, Chloroquine, Thiothixene, Doxorubicin, Tolterodine, Fluoxetine, Flecainide, Propranolol, Trimipramine, Rasagiline, Desipramine, Metoprolol, Tizanidine, Thioridazine, Ramelteon, Haloperidol, Tasimelteon, Ropinirole, Clomipramine, Olanzapine, Pimozide, Mexiletine, Duloxetine, Zidovudine, Dextromethorphan, Fluvoxamine, Theophylline, Acenocoumarol, Captopril, Lidocaine, Venlafaxine, Dacarbazine, Fluphenazine, Asenapine, Timolol, Bortezomib, Amitriptyline, Mirtazapine, Promazine, Nortriptyline, Primaquine, Imipramine, Metamfetamine, Aripiprazole, Amoxapine, Chlorpromazine, Tamoxifen, Flutamide, Ropivacaine, Telbivudine, Metamizole, Pegloticase, Carvedilol, Caffeine, Aminophylline, Perphenazine, Doxepin, Trifluoperazine, Vortioxetine, Iloperidone, Bromazepam, Betaxolol, Paroxetine, Pomalidomide, Tetrabenazine, Methadone, Stiripentol, Ribavirin, Maprotiline, Alosetron, Brexpiprazole"
Asparaginase Escherichia coli,Dexamethasone
Anakinra,"Abatacept, Canakinumab, Pomalidomide, Sipuleucel-T, Pimecrolimus, Adalimumab, Infliximab, Thalidomide, Leflunomide, Roflumilast, Denosumab, Tofacitinib, Golimumab, Natalizumab, Trastuzumab, Lenalidomide, Tacrolimus, Certolizumab pegol"
Human immunoglobulin G,"Estrone sulfate, Estradiol"
Anistreplase,"Apixaban, Vortioxetine, Cangrelor, Desirudin, Dalteparin, Floctafenine, Acenocoumarol, Rivaroxaban, Sulindac, Paroxetine, Desvenlafaxine, Naproxen, Fondaparinux, Enoxaparin, Caffeine, Bismuth subsalicylate, Ticagrelor, Citalopram, Oxaprozin, Prasugrel, Nabumetone, Edoxaban, Vilazodone, Tinzaparin, Piroxicam, Vorapaxar, Warfarin, Fenoprofen, Milnacipran, Fluoxetine, Salsalate, Flurbiprofen, Meloxicam, Tolmetin, Anagrelide, Epoprostenol, Cilostazol, Aminosalicylic acid, Tiaprofenic acid, Ketorolac, Acetylsalicylic acid, Venlafaxine, Diclofenac, Sertraline, Tirofiban, Diflunisal, Etodolac, Iloprost, Aprotinin, Dabigatran etexilate, Duloxetine, Eptifibatide, Magnesium salicylate, Argatroban, Treprostinil, Dihydrocodeine, Ticlopidine, Heparin, Dipyridamole, Indomethacin, Fluvoxamine, Danaparoid, Mefenamic acid, Clopidogrel, Ketoprofen, Levomilnacipran, Ibuprofen, Escitalopram, Abciximab, Nadroparin"
Insulin human,"Aripiprazole, Everolimus, Progesterone, Pasireotide, Selegiline, Methotrimeprazine, Darunavir, Tolbutamide, Cortisone acetate, Fluoxetine, Dihydrocodeine, Canagliflozin, Ceritinib, Fosamprenavir, Tacrolimus, Oxymetholone, Octreotide, Miglitol, Hydrocortisone, Aminosalicylic acid, Gliclazide, Vildagliptin, Tedizolid phosphate, Cyproterone acetate, Prednisolone, Ciprofloxacin, Dienogest, Rasagiline, Buserelin, Liraglutide, Epinephrine, Fludrocortisone, Nilotinib, Megestrol acetate, Acarbose, Chlorpropamide, Torasemide, Bromocriptine, Insulin glulisine, Sirolimus, Betamethasone, Vorinostat, Pipotiazine, Niacin, Mecasermin, Mestranol, Sitagliptin, Levofloxacin, Gliquidone, Caffeine, Salsalate, Pentamidine, Sunitinib, Norgestimate, Ethynodiol diacetate, Ritonavir, Procarbazine, Asenapine, Insulin detemir, Acetylsalicylic acid, Dapagliflozin, Glimepiride, Sulfisoxazole, Paroxetine, Desogestrel, Corticotropin, Articaine, Norethisterone, Linezolid, Ethinylestradiol, Chlorthalidone, Lurasidone, Ziprasidone, Vortioxetine, Furosemide, Nadolol, Pioglitazone, Isocarboxazid, Testosterone, Histrelin, Estradiol, Vilazodone, Arsenic trioxide, Sulfadiazine, Sparfloxacin, Exenatide, Dexamethasone, Repaglinide, Atazanavir, Indinavir, Lanreotide, Trimethoprim, Lopinavir, Metformin, Methylprednisolone, Indapamide, Ofloxacin, Triamcinolone, Saxagliptin, Medroxyprogesterone acetate, Tranylcypromine, Metolazone, Escitalopram, Pramlintide, Moxifloxacin, Sertraline, Clozapine, Saquinavir, Alogliptin, Diazoxide, Albiglutide, Paliperidone, Gemifloxacin, Oxandrolone, Trichlormethiazide, Acetohexamide, Rosiglitazone, Bendroflumethiazide, Disopyramide, Erythromycin, Dabrafenib, Tipranavir, Glipizide, Phenelzine, Pegvisomant, Mifepristone, Insulin degludec, Insulin glargine, Methyclothiazide, Drospirenone, Tolazamide, Norfloxacin, Fluoxymesterone, Moclobemide, Quinine, Brexpiprazole, Insulin aspart, Citalopram, Etonogestrel, Etacrynic acid, Hydrochlorothiazide, Triptorelin, Bismuth subsalicylate, Methyltestosterone, Lipoic acid, Iloperidone, Dulaglutide, Glyburide, Temsirolimus, Levonorgestrel, Quetiapine, Estrone sulfate, Sulfamethoxazole, Risperidone, Danazol, Linagliptin, Empagliflozin, Olanzapine, Nelfinavir, Stanolone, Bumetanide, Insulin lispro, Metreleptin, Nateglinide, Prednisone, Chlorothiazide, Magnesium salicylate, Edetic acid, Fluvoxamine, Hydroxyprogesterone caproate"
Tenecteplase,"Dalteparin, Paroxetine, Citalopram, Ibuprofen, Abciximab, Prasugrel, Ethyl biscoumacetate, Ticlopidine, Desvenlafaxine, Dipyridamole, Ticagrelor, Tinzaparin, Bismuth subsalicylate, Mefenamic acid, Diflunisal, Aprotinin, Acenocoumarol, Caffeine, Citric acid, Escitalopram, Meloxicam, Floctafenine, Tolmetin, Danaparoid, Venlafaxine, Tiaprofenic acid, Oxaprozin, Enoxaparin, Sertraline, Etodolac, Anagrelide, Fenoprofen, Apixaban, Aminosalicylic acid, Vortioxetine, Edetic acid, Magnesium salicylate, Flurbiprofen, Cangrelor, Desirudin, Dicoumarol, Rivaroxaban, Treprostinil, Diclofenac, Dabigatran etexilate, Fondaparinux, Limaprost, Eptifibatide, Warfarin, Phenindione, Salsalate, Duloxetine, Argatroban, Levomilnacipran, Heparin, Clopidogrel, Acetylsalicylic acid, Sulodexide, Milnacipran, Ketoprofen, Vorapaxar, Ketorolac, Nabumetone, Piroxicam, Vilazodone, Phenprocoumon, Fluoxetine, Sulindac, Nadroparin, Dihydrocodeine, Cilostazol, Naproxen, Indomethacin, Fluvoxamine, Epoprostenol, Tirofiban, Edoxaban, Iloprost"
Interferon gamma-1b,"Theophylline, Tizanidine, Zidovudine"
Desmopressin,"Hydrocortisone, Diflunisal, Warfarin, Hydrocodone, Sulindac, Meperidine, Infliximab, Promazine, Vortioxetine, Pentazocine, Dexamethasone, Naproxen, Oxycodone, Floctafenine, Aminosalicylic acid, Dihydrocodeine, Hydromorphone, Ketorolac, Acenocoumarol, Fenoprofen, Citalopram, Desvenlafaxine, Betamethasone, Morphine, Oxaprozin, Fluoxetine, Ketoprofen, Venlafaxine, Carbamazepine, Cortisone acetate, Nabumetone, Fludrocortisone, Celecoxib, Buprenorphine, Fentanyl, Sertraline, Trimipramine, Imipramine, Lithium cation, Indomethacin, Bismuth subsalicylate, Triamcinolone, Methadone, Lamotrigine, Doxepin, Tapentadol, Duloxetine, Amitriptyline, Clomipramine, Vilazodone, Ibuprofen, Corticotropin, Pemetrexed, Piroxicam, Prednisolone, Levorphanol, Desipramine, Salsalate, Remifentanil, Magnesium salicylate, Etodolac, Tolmetin, Oxymorphone, Escitalopram, Alfentanil, Levomilnacipran, Butorphanol, Acetylsalicylic acid, Demeclocycline, Tramadol, Amoxapine, Chlorpromazine, Tolvaptan, Prednisone, Sufentanil, Nalbuphine, Fluvoxamine, Milnacipran, Mefenamic acid, Caffeine, Nortriptyline, Methylprednisolone, Protriptyline, Flurbiprofen, Paroxetine, Meloxicam, Tiaprofenic acid, Diclofenac"
Coagulation factor VIIa Recombinant Human,Catridecacog
Palifermin,"Enoxaparin, Ardeparin, Heparin, Dalteparin, Tinzaparin, Nadroparin"
Glucagon,"Pimozide, Clemastine, Olanzapine, Isocarboxazid, Desipramine, Protriptyline, Azelastine, Tranylcypromine, Warfarin, Zuclopenthixol, Solifenacin, Risperidone, Homatropine, Dimenhydrinate, Olopatadine, Thiothixene, Fesoterodine, Doxylamine, Clozapine, Trimipramine, Atropine, Glycopyrronium, Trifluoperazine, Triprolidine, Disopyramide, Pizotifen, Amoxapine, Tolterodine, Hyoscyamine, Levocetirizine, Aclidinium, Dicyclomine, Darifenacin, Carbinoxamine, Trospium, Moclobemide, Meclizine, Hydroxyzine, Loxapine, Loratadine, Ipratropium, Imipramine, Thioridazine, Promethazine, Cyclopentolate, Propantheline, Cyclobenzaprine, Trimethobenzamide, Benzatropine, Cyclizine, Flavoxate, Fluphenazine, Brompheniramine, Amitriptyline, Cyproheptadine, Chlorpheniramine, Mepenzolate, Chlorpromazine, Butylscopolamine, Trihexyphenidyl, Procyclidine, Doxepin, Dexchlorpheniramine maleate, Levocabastine, Methscopolamine, Quetiapine, Desloratadine, Orphenadrine, Acenocoumarol, Haloperidol, Methotrimeprazine, Tiotropium, Promazine, Perphenazine, Maprotiline, Diphenhydramine, Clomipramine, Flupentixol, Scopolamine, Umeclidinium, Nortriptyline, Phenelzine, Fexofenadine, Oxybutynin, Indomethacin, Prochlorperazine, Droperidol, Cetirizine"
Aldesleukin,"Amlodipine, Difluprednate, Valsartan, Torasemide, Clobetasol propionate, Carvedilol, Nifedipine, Eplerenone, Carteolol, Acetaminophen, Methyldopa, Ramipril, Prazosin, Triamterene, Propranolol, Heptabarbital, Iodipamide, Nadolol, Perindopril, Risperidone, Irbesartan, Ioxilan, Fluocinolone acetonide, Dexamethasone, Acebutolol, Sotalol, Iopromide, Indapamide, Esmolol, Reserpine, Aliskiren, Isosorbide, Losartan, Enalapril, Metoprolol, Trandolapril, Captopril, Methyclothiazide, Levodopa, Lisinopril, Amcinonide, Brimonidine, Amyl Nitrite, Secobarbital, Nicorandil, Nisoldipine, Atenolol, Felodipine, Azilsartan medoxomil, Iohexol, Iopamidol, Prednisolone, Cilazapril, Diltiazem, Metamizole, Betaxolol, Quetiapine, Nimodipine, Fluticasone furoate, Halcinonide, Caffeine, Labetalol, Hexobarbital, Tizanidine, Dexmedetomidine, Eprosartan, Nicardipine, Minoxidil, Butabarbital, Duloxetine, Hydrocortamate, Telmisartan, Nitroglycerin, Olmesartan, Penbutolol, Diclofenamide, Butobarbital, Fluocinonide, Timolol, Cortisone acetate, Moexipril, Phenobarbital, Isosorbide dinitrate, Verapamil, Nebivolol, Dipyridamole, Amobarbital, Butalbital, Methohexital, Hydrochlorothiazide, Methazolamide, Nitroprusside, Pentobarbital, Riociguat, Flurandrenolide, Betamethasone, Prednisone, Doxazosin, Ioversol, Candesartan cilexetil, Mecamylamine, Fludrocortisone, Metformin, Fluorometholone, Clonidine, Isradipine, Budesonide, Diatrizoate, Desoximetasone, Entacapone, Alclometasone, Etacrynic acid, Iodixanol, Ethiodized oil, Amiloride, Dapagliflozin, Chlorthalidone, Clozapine, Mannitol, Spironolactone, Terazosin, Prednicarbate, Interferon alfacon-1, Canagliflozin, Hydrocortisone, Methylprednisolone, Corticotropin, Bendroflumethiazide, Triamcinolone, Fosinopril, Diflorasone, Acetazolamide, Benazepril, Metipranolol, Pindolol, Enalaprilat, Bisoprolol, Nesiritide, Isoxsuprine, Apraclonidine, Bumetanide, Beclomethasone dipropionate, Quinapril, Chlorothiazide, Mometasone, Isosorbide mononitrate, Rimexolone, Furosemide, Ulobetasol, Clocortolone, Primidone, Empagliflozin, Dinutuximab, Clevidipine, Metolazone, Bretylium, Hydralazine, Carbidopa, Levobunolol, Guanfacine, Papaverine"
Botulinum Toxin Type B,"Botulinum toxin type A, Brompheniramine, Amitriptyline, Procyclidine, Doxylamine, Tranylcypromine, Tolterodine, Perphenazine, Loratadine, Orphenadrine, Tobramycin, Trimethobenzamide, Glycopyrronium, Doxepin, Aclidinium, Tiotropium, Methscopolamine, Rocuronium, Thioridazine, Dicyclomine, Pizotifen, Droperidol, Levocetirizine, Amoxapine, Atropine, Hyoscyamine, Zuclopenthixol, Scopolamine, Gentamicin, Phenelzine, Vecuronium, Atracurium besylate, Flavoxate, Imipramine, Chlorpheniramine, Olanzapine, Pancuronium, Amikacin, Fesoterodine, Trifluoperazine, Azelastine, Desloratadine, Protriptyline, Nortriptyline, Dimenhydrinate, Cyclizine, Prochlorperazine, Quetiapine, Trimipramine, Moclobemide, Streptomycin, Cyproheptadine, Fexofenadine, Clomipramine, Fluphenazine, Disopyramide, Haloperidol, Methotrimeprazine, Dexchlorpheniramine maleate, Cetirizine, Trospium, Promazine, Darifenacin, Pimozide, Kanamycin, Isocarboxazid, Homatropine, Hydroxyzine, Ipratropium, Cyclobenzaprine, Benzatropine, Cisatracurium, Butylscopolamine, Meclizine, Carbinoxamine, Clemastine, Trihexyphenidyl, Promethazine, Diphenhydramine, Flupentixol, Maprotiline, Mepenzolate, Risperidone, Umeclidinium, Clozapine, Cyclopentolate, Levocabastine, Desipramine, Loxapine, Solifenacin, Triprolidine, Thiothixene, Neomycin, Olopatadine, Oxybutynin, Chlorpromazine, Propantheline, Succinylcholine"
Omalizumab,"Belimumab, Loxapine"
Insulin lispro,"Norgestimate, Albiglutide, Bromocriptine, Brexpiprazole, Dapagliflozin, Bumetanide, Articaine, Methylprednisolone, Canagliflozin, Erythromycin, Iloperidone, Ceritinib, Chlorthalidone, Dabrafenib, Cyproterone acetate, Everolimus, Acetylsalicylic acid, Tacrolimus, Diazoxide, Furosemide, Insulin detemir, Pegvisomant, Pioglitazone, Pramlintide, Repaglinide, Nadolol, Lanreotide, Methotrimeprazine, Progesterone, Medroxyprogesterone acetate, Acetohexamide, Alogliptin, Arsenic trioxide, Hydrochlorothiazide, Metolazone, Niacin, Sparfloxacin, Miglitol, Buserelin, Insulin aspart, Disopyramide, Hydrocortisone, Trimethoprim, Tolbutamide, Bendroflumethiazide, Insulin degludec, Epinephrine, Liraglutide, Paroxetine, Nilotinib, Pipotiazine, Testosterone, Oxandrolone, Mecasermin, Quinine, Indapamide, Betamethasone, Trichlormethiazide, Lopinavir, Histrelin, Insulin glargine, Vildagliptin, Phenelzine, Nelfinavir, Aripiprazole, Mestranol, Desogestrel, Hydroxyprogesterone caproate, Levonorgestrel, Torasemide, Triamcinolone, Danazol, Etacrynic acid, Estrone sulfate, Atazanavir, Glyburide, Dulaglutide, Glimepiride, Sirolimus, Vorinostat, Temsirolimus, Lurasidone, Prednisone, Insulin glulisine, Acarbose, Gliquidone, Norethisterone, Saxagliptin, Nateglinide, Dexamethasone, Indinavir, Sunitinib, Linagliptin, Triptorelin, Megestrol acetate, Methyclothiazide, Sulfadiazine, Pasireotide, Dienogest, Risperidone, Mifepristone, Pentamidine, Fludrocortisone, Stanolone, Cortisone acetate, Paliperidone, Sitagliptin, Ethinylestradiol, Glipizide, Metreleptin, Quetiapine, Prednisolone, Drospirenone, Chlorpropamide, Etonogestrel, Edetic acid, Sulfamethoxazole, Tipranavir, Gliclazide, Tolazamide, Lipoic acid, Darunavir, Saquinavir, Estradiol, Olanzapine, Clozapine, Chlorothiazide, Sulfisoxazole, Octreotide, Ethynodiol diacetate, Ritonavir, Ziprasidone, Asenapine, Empagliflozin, Exenatide, Rosiglitazone, Tranylcypromine, Fosamprenavir, Metformin, Corticotropin"
