Drug_Name,Interactions
Norgestimate,"Edetic acid, Acenocoumarol, Saxagliptin, Heparin, Eslicarbazepine acetate, Insulin glulisine, Gliquidone, Anthrax immune globulin human, St. John's Wort, Butobarbital, Lumacaftor, Human C1-esterase inhibitor, Vildagliptin, Canagliflozin, Citric acid, Alogliptin, Insulin detemir, Heptabarbital, Gliclazide, Saquinavir, Glyburide, Hexobarbital, Linagliptin, Enoxaparin, Tolbutamide, Tesmilifene, Sulodexide, Dalteparin, Insulin aspart, Ethyl biscoumacetate, Cyproterone acetate"
Carboplatin,"Denosumab, Roflumilast, Metamizole, Arbekacin, Tofacitinib, Kanamycin, Streptomycin, Leflunomide, Paclitaxel, Neomycin, Ribostamycin, Topotecan, Sipuleucel-T"
Methylprednisolone,"Boceprevir, Nicorandil, Rifampicin, Leflunomide, Vildagliptin, Roflumilast, Darunavir, Aluminum hydroxide, Gliquidone, Corticorelin ovine triflutate, Glyburide, Ceritinib, Enzalutamide, Magnesium oxide, Benzoic acid, Gliclazide, Canagliflozin, Atazanavir, Cobicistat, Tofacitinib, Nefazodone, Insulin detemir, Trichlormethiazide, Rifapentine, Tolbutamide, Indacaterol, Sipuleucel-T, Deferasirox, Telithromycin, Clarithromycin, Sparfloxacin, Telaprevir, Insulin aspart, Idelalisib, Insulin glulisine, Saxagliptin, Stanolone, Saquinavir, Linagliptin, Denosumab, Alogliptin, Itraconazole, Fosaprepitant, Posaconazole, Ketoconazole, Phenobarbital, Fosphenytoin, Calcium carbonate"
Pindolol,"Diazoxide, Amiodarone, Rivastigmine, Nifedipine, Ceritinib, Obinutuzumab, Molsidomine, Acepromazine, Nicorandil, Bupropion, Fingolimod, Levodopa, Ruxolitinib, Ivabradine, Methacholine, Regorafenib, Aripiprazole, Dronedarone, Hexobarbital, Mepivacaine, Lacosamide, Acetylcholine, Tofacitinib, Propafenone, Amifostine, Floctafenine, Heptabarbital, Butobarbital, Yohimbine, Dipyridamole, Bretylium, Moxonidine"
Mepivacaine,"Isoprenaline, Clenbuterol, Nebivolol, Penbutolol, Metamfetamine, Acebutolol, Mephentermine, Chlorphentermine, Levobunolol, Naphazoline, Carvedilol, Metipranolol, Technetium Tc-99m tilmanocept, Formoterol, Fenoterol, Dopamine, Nadolol, Doxofylline, Iobenguane"
Zaleplon,"Orphenadrine, Thalidomide, Methotrimeprazine, Perampanel, Rifampicin, Rufinamide, Fosphenytoin, Minocycline, Sodium oxybate, Rotigotine, Rifapentine, Flumazenil, Paraldehyde, Suvorexant, Tapentadol, Phenobarbital, Enzalutamide, Azelastine"
Apraclonidine,"Heptabarbital, Levodopa, Isocarboxazid, Selegiline, Tedizolid phosphate, Hexobarbital, Rasagiline, Procarbazine, Moclobemide, Mianserin, Nicorandil, Butobarbital"
Telmisartan,"Moxonidine, Levodopa, Obinutuzumab, Butobarbital, Drospirenone, Tolvaptan, Nicorandil, Heptabarbital, Amifostine, Yohimbine, Lithium cation, Hexobarbital, Canagliflozin, Diazoxide, Molsidomine, Aliskiren, Dapoxetine, Heparin"
Desloratadine,"Cathinone, Perampanel, Paraldehyde, Tesmilifene, Tiotropium, Lumacaftor, Umeclidinium, Methotrimeprazine, Rotigotine, Betahistine, Orphenadrine, Rufinamide, Cimetropium, Pramlintide, Suvorexant, Minocycline, Azelastine, Aclidinium, Itopride, Mianserin, Eluxadoline, Saquinavir, Tapentadol, Sodium oxybate, Mirabegron, Ramosetron, Trichlormethiazide, Thalidomide"
Methyldopa,"Procarbazine, Nicorandil, Isocarboxazid, Ivabradine, Obinutuzumab, Lithium cation, Moclobemide, Molsidomine, Rasagiline, Amifostine, Yohimbine, Tofacitinib, Ruxolitinib, Selegiline, Bretylium, Ceritinib, Lacosamide, Moxonidine, Tedizolid phosphate, Levodopa, Diazoxide, Iobenguane, Butobarbital, Nadolol, Heptabarbital, Hexobarbital"
Alosetron,"Idelalisib, Posaconazole, Eluxadoline, Nefazodone, Vemurafenib, Boceprevir, Saquinavir, Tapentadol, Clarithromycin, Itraconazole, Telithromycin, Cobicistat, Ketoconazole, Abiraterone, Telaprevir, Atazanavir, Darunavir, Deferasirox, Ceritinib"
Dactinomycin,"Tofacitinib, Sipuleucel-T, Leflunomide, Roflumilast, Metamizole, Denosumab"
Azelastine,"Butylscopolamine, Mirabegron, Estazolam, Tetrabenazine, Dantrolene, Amobarbital, Gabapentin, Zuclopenthixol, Clofedanol, Fosphenytoin, Ramosetron, Cathinone, Ziconotide, Ketamine, Methotrimeprazine, Stiripentol, Desipramine, Trichlormethiazide, Ezogabine, Diphenhydramine, Sevoflurane, Chlorpheniramine, Pipotiazine, Iloperidone, Eluxadoline, Levocetirizine, Rufinamide, Sodium oxybate, Nitrous oxide, Paraldehyde, Perampanel, Clomipramine, gamma-Hydroxybutyric acid, Ramelteon, Pomalidomide, Tasimelteon, Cyclizine, Paliperidone, Bromazepam, Gabapentin enacarbil, Betahistine, Tapentadol, Cimetropium, Levetiracetam, Tiotropium, Itopride, Promethazine, Rotigotine, Clonazepam, Nitrazepam, Levodopa, Dihydrocodeine, Guanfacine, Pizotifen, Levocabastine, Umeclidinium, Dimenhydrinate, Aripiprazole, Oxymorphone, Desflurane, Thalidomide, Suvorexant, Flunarizine, Quetiapine, Dexchlorpheniramine maleate, Quazepam, Doxepin, Pimozide, Thiothixene, Aclidinium, Diphenoxylate, Minocycline, Asenapine, Phenobarbital, Methsuximide, Vigabatrin, Pramlintide, Difenoxin, Lurasidone, Brexpiprazole, Flibanserin, Zopiclone, Orphenadrine"
Ezetimibe,"Cholestyramine, Eltrombopag, Fenofibrate, Teriflunomide, Gemfibrozil, Bezafibrate"
Edetic acid,"Prasugrel, Insulin detemir, Omega-3-acid ethyl esters, Ibrutinib, Vorapaxar, Danaparoid, Dipyridamole, Estrone sulfate, Dabigatran etexilate, Levomilnacipran, Ethinylestradiol, Apixaban, Vortioxetine, Rivaroxaban, Cangrelor, Iloprost, Dasatinib, Icosapent ethyl, Cyproterone acetate, Nadroparin, Drospirenone, Vilazodone, Escitalopram, Oxaprozin, Heparin, Tinzaparin, Enoxaparin, Desirudin, Insulin glulisine, Insulin degludec, Insulin aspart, Dienogest, Sertraline, Edoxaban, Desvenlafaxine, Epoprostenol, Deoxycholic acid, Deferasirox, Mestranol, Bismuth subsalicylate, Dalteparin, Nintedanib, Salsalate, Omega-3 fatty acids, Dihydrocodeine, Ketoprofen, Floctafenine, Tiaprofenic acid, Cilostazol, Magnesium salicylate, Ticagrelor, Ibuprofen, Hydroxyprogesterone caproate, Milnacipran, Obinutuzumab, Acenocoumarol"
Dipyridamole,"Dasatinib, Nadolol, Penbutolol, Edoxaban, Silodosin, Dalteparin, Deoxycholic acid, Glucosamine, Ridogrel, Colchicine, Acenocoumarol, Nebivolol, Enoxaparin, Ledipasvir, Levodopa, Citric acid, Sulodexide, Naloxegol, Regadenoson, Neostigmine, Limaprost, Dabigatran etexilate, Rifaximin, Edrophonium, Everolimus, Rivaroxaban, Brentuximab vedotin, Heparin, Nicorandil, Bosutinib, Apixaban, Physostigmine, Butobarbital, Omega-3 fatty acids, Hexobarbital, Prucalopride, Ibrutinib, Doxorubicin, Topotecan, Acebutolol, Ethyl biscoumacetate, Obinutuzumab, Saquinavir, Riociguat, Afatinib, Pazopanib, Rivastigmine, Carvedilol, Heptabarbital"
Telithromycin,"Everolimus, Naloxegol, Vilazodone, Romidepsin, St. John's Wort, Tolterodine, Parecoxib, Dasatinib, Bedaquiline, Amrinone, Ibrutinib, Deferasirox, Guanfacine, Fesoterodine, Cilostazol, Maraviroc, Ruxolitinib, Suvorexant, Pitavastatin, Idelalisib, Vemurafenib, Ixabepilone, Macitentan, Aripiprazole, Budesonide, Bepridil, Panobinostat, Avanafil, Trabectedin, Colchicine, Oxybutynin, Lacosamide, Tasimelteon, Saxagliptin, Regorafenib, Simeprevir, Apixaban, Fusidic acid, Prasugrel, Dabrafenib, Cobicistat, Lurasidone, Imidafenacin, Perhexiline, Netupitant, Picosulfuric acid, Rilpivirine, Stiripentol, Dronedarone, Levomilnacipran, Ramelteon, Ifosfamide, Ketoconazole, Pazopanib, Atorvastatin, Trastuzumab emtansine, Cabazitaxel, Domperidone, Dapoxetine, Cabozantinib, Ulipristal, Brexpiprazole, Zopiclone, Nilotinib, Etizolam, Dutasteride, Halofantrine, Olaparib, Lomitapide, Felodipine, Sonidegib, Nitrendipine, Isavuconazonium, Ivabradine, Siltuximab, Bosutinib, Doxorubicin, Dienogest, Silodosin, Prenylamine, Flunarizine, Palbociclib, Crizotinib, Drospirenone, Ospemifene, Ponatinib, Tolvaptan, Luliconazole, Vorapaxar, Tofacitinib, Pranlukast, Brinzolamide, Lapatinib, Estazolam, Ticagrelor, Levobupivacaine, Flibanserin, Daclatasvir, Tocilizumab, Retapamulin, Ivacaftor, Pimozide, Itraconazole, Brentuximab vedotin, Gabapentin, Ceritinib, Axitinib, Telaprevir, Temsirolimus, Barnidipine"
Ethinylestradiol,"Ethyl biscoumacetate, Acenocoumarol, Eslicarbazepine acetate, Lumacaftor, Alogliptin, Rufinamide, Vildagliptin, Human C1-esterase inhibitor, Saxagliptin, Heptabarbital, Gliclazide, Sulodexide, Insulin aspart, Insulin glulisine, Hexobarbital, Tolbutamide, Simeprevir, Gliquidone, Anthrax immune globulin human, Heparin, Dalteparin, Linagliptin, Batimastat, Citric acid, Butobarbital, Enoxaparin, Glyburide, St. John's Wort, Insulin detemir, Canagliflozin"
Cyclopentolate,"Pramlintide, Eluxadoline, Trichlormethiazide, Umeclidinium, Aclidinium, Tiotropium, Ramosetron, Itopride, Cimetropium, Mianserin, Mirabegron"
Ramelteon,"Telaprevir, Rifampicin, Paraldehyde, Abiraterone, Suvorexant, Tolbutamide, Thalidomide, Rotigotine, Orphenadrine, Ketoconazole, Tapentadol, Cobicistat, Idelalisib, Atazanavir, Ceritinib, Perampanel, Capecitabine, Posaconazole, Darunavir, Methotrimeprazine, Boceprevir, Minocycline, Clarithromycin, Rifapentine, Sodium oxybate, Saquinavir, Itraconazole, Vemurafenib, Rufinamide, Nefazodone, Deferasirox, Gemfibrozil"
Physostigmine,"Acetylcholine, Nadolol"
Isotretinoin,Mipomersen
Formoterol,"Aminophylline, Dopamine, Isometheptene, Acebutolol, Racepinephrine, Pirbuterol, Trichlormethiazide, Betahistine, Lisdexamfetamine, Arformoterol, Pheniramine, Levonordefrin, Metamfetamine, Articaine, Dextroamphetamine, Propylhexedrine, Olodaterol, Fenoterol, Atosiban, Clenbuterol, Dihydrocodeine, Naphazoline, Chlorphentermine, Mephentermine, Doxofylline, Desflurane, Sevoflurane, Tedizolid phosphate, Dexmethylphenidate, Armodafinil, Salbutamol, Vilanterol, Ephedrine, Isoprenaline, Indacaterol, Phendimetrazine, Nadolol, Iobenguane"
Nandrolone phenpropionate,Methoxy polyethylene glycol-epoetin beta
Dimenhydrinate,"Mirabegron, Rotigotine, Paraldehyde, Aclidinium, Suvorexant, Cathinone, Orphenadrine, Itopride, Sodium oxybate, Mianserin, Pramlintide, Perampanel, Tapentadol, Thalidomide, Cimetropium, Minocycline, Rufinamide, Eluxadoline, Betahistine, Methotrimeprazine, Ramosetron, Trichlormethiazide, Umeclidinium, Tiotropium"
Glycopyrronium,"Methscopolamine, Eluxadoline, Mirabegron, Cimetropium, Pramlintide, Itopride, Aclidinium, Tiotropium, Dexchlorpheniramine maleate, Ramosetron, Homatropine, Mianserin, Levodopa, Umeclidinium, Butylscopolamine, Trichlormethiazide"
Cytarabine,"Flucytosine, Sipuleucel-T, Roflumilast, Tofacitinib, Leflunomide, Metamizole, Denosumab"
Dopamine,"Sevoflurane, Olodaterol, Tedizolid phosphate, Salbutamol, Bupropion, Isoprenaline, Indacaterol, Aminophylline, Lisdexamfetamine, Lurasidone, Racepinephrine, Ephedrine, Clenbuterol, Doxofylline, Naphazoline, Desflurane, Armodafinil, Metamfetamine, Levonordefrin, Articaine, Mephentermine, Phendimetrazine, Iobenguane, Dexmethylphenidate, Nadolol, Isometheptene, Pirbuterol, Chlorphentermine, Dihydrocodeine, Arformoterol, Acebutolol, Dextroamphetamine, Pheniramine, Vilanterol, Propylhexedrine, Fenoterol"
Rivastigmine,"Fluspirilene, Penbutolol, Bretylium, Pimozide, Acebutolol, Paliperidone, Carvedilol, Fencamfamin, Chlorprothixene, Acetylcholine, Quetiapine, Metoclopramide, Levobunolol, Chlormezanone, Lacosamide, Nadolol, Molindone, Nebivolol, Carphenazine, Tofacitinib, Ivabradine, Zuclopenthixol, Ruxolitinib, Thiothixene, Sertindole, Amisulpride, Aripiprazole, Acepromazine, Metipranolol, Ceritinib, Acetophenazine, Methotrimeprazine"
Exemestane,"Siltuximab, Phenobarbital, Estrone sulfate, Deferasirox, Rifampicin, Fosphenytoin, St. John's Wort, Tocilizumab, Dabrafenib, Enzalutamide, Aripiprazole, Saxagliptin, Rifapentine"
Oxaprozin,"Dasatinib, Ridogrel, Hydralazine, Omacetaxine mepesuccinate, Aliskiren, Kanamycin, Ibrutinib, Dalteparin, Ribostamycin, Limaprost, Omega-3 fatty acids, Dabigatran etexilate, Balsalazide, Sparfloxacin, Apixaban, Neomycin, Drospirenone, Dexketoprofen, Talniflumate, Trichlormethiazide, Streptomycin, Citric acid, Enoxaparin, Obinutuzumab, Nadolol, Rivaroxaban, Deoxycholic acid, Arbekacin, Sulodexide, Morniflumate, Ethyl biscoumacetate, Unoprostone, Glucosamine, Probenecid, Heparin, Acenocoumarol, Lithium cation, Deferasirox, Floctafenine, Pralatrexate"
Azathioprine,"Acenocoumarol, Roflumilast, Febuxostat, Balsalazide, Tofacitinib, Enalaprilat, Captopril, Cilazapril, Sulfamethoxazole, Denosumab, Mercaptopurine, Sipuleucel-T, Leflunomide"
Neomycin,"Bacampicillin, Ceftibuten, Azlocillin, Cefprozil, Cefpodoxime, Cyclacillin, Cefoxitin, Pivampicillin, Pivmecillinam, Avibactam, Benzylpenicillin, Ticarcillin, Amdinocillin, Tiaprofenic acid, Picosulfuric acid, Meticillin, Cloxacillin, Ketoprofen, Pancuronium, Acenocoumarol, Azidocillin, Cefepime, Colistimethate, Tiludronic acid, Ibuprofen, Ceftriaxone, Vecuronium, Amoxicillin, Cefotetan, Cefuroxime, Floctafenine"
Gabapentin,"Minocycline, Magnesium oxide, Calcium citrate, Mianserin, Phenobarbital, Magnesium salicylate, Orphenadrine, Methotrimeprazine, Magnesium hydroxide, Ketoconazole, Suvorexant, Sodium oxybate, Amobarbital, Calcium chloride, Perampanel, Rufinamide, Terazosin, Pancuronium, Thalidomide, Calcium carbonate, Sodium bicarbonate, Rifampicin, Itraconazole, Rotigotine, Rifapentine, Calcium gluconate, Silodosin, Fosphenytoin, Paraldehyde, Posaconazole, Magnesium citrate, Aluminum hydroxide, Clarithromycin, Magnesium chloride, Tapentadol, Orlistat, Vecuronium"
Doxorubicin,"Tesmilifene, Stiripentol, Fosamprenavir, Atorvastatin, Siltuximab, Sofosbuvir, Tocilizumab, Mirabegron, Rifapentine, Idelalisib, Ivacaftor, Denosumab, Phenobarbital, Sunitinib, Roflumilast, Simeprevir, Netupitant, Ceritinib, Lorcaserin, Lopinavir, Mercaptopurine, Telaprevir, Aripiprazole, Lumefantrine, St. John's Wort, Vemurafenib, Methotrimeprazine, Ketoconazole, Dabrafenib, Boceprevir, Abiraterone, Amiodarone, Tofacitinib, Sipuleucel-T, Saquinavir, Ibrutinib, Cabazitaxel, Desipramine, Sertraline, Artemether, Deferasirox, Paclitaxel, Leflunomide, Panobinostat, Luliconazole, Posaconazole, Nilotinib, Rifampicin, Fosaprepitant, Atazanavir, Fosphenytoin, Enzalutamide, Ledipasvir, Cobicistat, Isavuconazonium, Palbociclib, Rolapitant, Dronedarone, Lapatinib, Dasatinib, Cinacalcet, Fusidic acid, Crizotinib, Nefazodone, Clarithromycin, Darunavir, Clomipramine, Flibanserin, Daclatasvir, Lomitapide, Carvedilol, Bupropion, Itraconazole, Eliglustat, Diphenhydramine, Vandetanib, Metamizole"
Frovatriptan,"Fluspirilene, Tedizolid phosphate, Quetiapine, Fencamfamin, Sertindole, Acepromazine, Acetophenazine, Chlormezanone, Molindone, Thiothixene, Pimozide, Amisulpride, Droxidopa, Zuclopenthixol, Paliperidone, Carphenazine, Dapoxetine, Aripiprazole, Methotrimeprazine, Metoclopramide, Chlorprothixene"
Hydrochlorothiazide,"Chlorpheniramine, Alogliptin, Canagliflozin, Glyburide, Gliclazide, Molsidomine, Heptabarbital, Tapentadol, Licorice, Tolbutamide, Insulin glulisine, Vildagliptin, Obinutuzumab, Diazoxide, Insulin aspart, Dihydrocodeine, Linagliptin, Levodopa, Nicorandil, Oxymorphone, Amifostine, Hexobarbital, Butobarbital, Dihydrotachysterol, Insulin detemir, Dexketoprofen, Moxonidine, Ivabradine, Yohimbine, Saxagliptin, Lithium cation, Gliquidone"
Cyclacillin,"Minocycline, Kanamycin, Mycophenolic acid, Streptomycin, Probenecid, Acenocoumarol"
Salbutamol,"Mephentermine, Naphazoline, Chlorphentermine, Tedizolid phosphate, Metamfetamine, Doxofylline, Betahistine, Acebutolol, Fenoterol, Clenbuterol, Atosiban, Nadolol, Isoprenaline, Trichlormethiazide, Iobenguane"
Levobupivacaine,"Boceprevir, Itraconazole, Atazanavir, Clarithromycin, Nefazodone, Cobicistat, Posaconazole, Saquinavir, Darunavir, Ketoconazole, Idelalisib, Telaprevir, Ceritinib"
Ganciclovir,"Mycophenolic acid, Abacavir, Cilastatin, Probenecid, Imipenem"
Hydroxyurea,"Roflumilast, Leflunomide, Metamizole, Denosumab, Tofacitinib, Sipuleucel-T"
Letrozole,"Tegafur, Artesunate"
Tioconazole,Aripiprazole
Busulfan,"Propacetamol, Fosphenytoin, Denosumab, Posaconazole, Ifosfamide, Metamizole, Ketoconazole, Tofacitinib, Sipuleucel-T, Leflunomide, Roflumilast, Itraconazole"
Ketoprofen,"Aliskiren, Floctafenine, Omega-3 fatty acids, Apixaban, Omacetaxine mepesuccinate, Ethyl biscoumacetate, Acenocoumarol, Dalteparin, Dexketoprofen, Streptomycin, Nadolol, Teriflunomide, Glucosamine, Hydralazine, Balsalazide, Dasatinib, Pralatrexate, Arbekacin, Ridogrel, Dabigatran etexilate, Enoxaparin, Talniflumate, Rivaroxaban, Kanamycin, Lithium cation, Sparfloxacin, Drospirenone, Unoprostone, Morniflumate, Citric acid, Sulodexide, Probenecid, Ribostamycin, Ibrutinib, Obinutuzumab, Deferasirox, Limaprost, Trichlormethiazide, Deoxycholic acid, Heparin"
Edrophonium,"Acetylcholine, Nadolol"
Metyrapone,"Aripiprazole, Propacetamol, Saxagliptin, Fosphenytoin"
Cinacalcet,"Eliglustat, Clomipramine, Vortioxetine, Dasatinib, Aripiprazole, Tetrabenazine, Fosaprepitant, Nebivolol, Fesoterodine, Pimozide, Doxepin, Brexpiprazole, Simeprevir, Propafenone, Idelalisib, Stiripentol, Desipramine, Netupitant, Luliconazole, Iloperidone, Ivacaftor, Mequitazine, Fusidic acid, Palbociclib"
Clobetasol propionate,"Corticorelin ovine triflutate, Deferasirox, Ceritinib"
Balsalazide,"Ibuprofen, Tinzaparin, Floctafenine, Tiaprofenic acid, Mercaptopurine, Nadroparin, Enoxaparin, Heparin, Dalteparin"
Sulfamethoxazole,"Pralatrexate, Sparfloxacin, Tolbutamide, Linagliptin, Dexketoprofen, Picosulfuric acid, Canagliflozin, Stanolone, St. John's Wort, Methenamine, Mercaptopurine, Gliclazide, Saxagliptin, Vildagliptin, Gliquidone, Alogliptin, Insulin detemir, Glyburide, Insulin glulisine, Insulin aspart"
Glyburide,"Diazoxide, Rifampicin, Carbocisteine, Gliquidone, Dabrafenib, Estrone sulfate, Arsenic trioxide, Lurasidone, Dienogest, Trichlormethiazide, Methotrimeprazine, Drospirenone, Sunitinib, Insulin glulisine, Saxagliptin, Corticotropin, Paliperidone, Histrelin, Sitagliptin, Canagliflozin, Lanreotide, Exenatide, Pasireotide, Sparfloxacin, Quetiapine, Temsirolimus, Atazanavir, Hydroxyprogesterone caproate, Metreleptin, Vildagliptin, Nilotinib, Buserelin, Stanolone, Linagliptin, Fenofibrate, Darunavir, Mecasermin, Lopinavir, Everolimus, Insulin detemir, Insulin aspart, Tolbutamide, Aripiprazole, Vorinostat, Insulin degludec, Asenapine, Clarithromycin, Alogliptin, Triptorelin, Brexpiprazole, Cyproterone acetate, Articaine, Mestranol, Danazol, Pipotiazine, Nadolol, Saquinavir, Lumacaftor, Cholic Acid, Iloperidone, Fosamprenavir, Dexamethasone, Gliclazide, Probenecid, Ceritinib, Cortisone acetate, Miconazole, Glipizide, Dexketoprofen"
Minocycline,"Doxepin, Atazanavir, Quetiapine, Pizotifen, Ketamine, Methsuximide, Guanfacine, Tetrabenazine, gamma-Hydroxybutyric acid, Gabapentin enacarbil, Levocabastine, Desipramine, Vecuronium, Tapentadol, Pipotiazine, Ticarcillin, Ezogabine, Nitrazepam, Cloxacillin, Tasimelteon, Bacampicillin, Dantrolene, Iloperidone, Brexpiprazole, Perampanel, Strontium ranelate, Suvorexant, Sevoflurane, Meticillin, Paraldehyde, Aluminum hydroxide, Flunarizine, Diphenhydramine, Bismuth subsalicylate, Estazolam, Asenapine, Cyclizine, Amdinocillin, Phenobarbital, Nitrous oxide, Pivampicillin, Sodium oxybate, Dexchlorpheniramine maleate, Aripiprazole, Butylscopolamine, Stiripentol, Chlorpheniramine, Thiothixene, Desflurane, Quazepam, Ziconotide, Levocetirizine, Levetiracetam, Pomalidomide, Amobarbital, Clonazepam, Pimozide, Mipomersen, Promethazine, Azlocillin, Clomipramine, Fosphenytoin, Flibanserin, Amoxicillin, Iron sucrose, Orphenadrine, Picosulfuric acid, Lurasidone, Pancuronium, Vigabatrin, Pivmecillinam, Paliperidone, Methotrimeprazine, Benzylpenicillin, Azidocillin, Zopiclone, Zuclopenthixol, Bromazepam, Thalidomide, Bismuth subcitrate potassium, Calcium carbonate, Magnesium oxide, Oxymorphone"
Guanfacine,"Dasatinib, Orphenadrine, Tocilizumab, Tapentadol, Levodopa, Telaprevir, St. John's Wort, Yohimbine, Tofacitinib, Moxonidine, Rotigotine, Lacosamide, Boceprevir, Nadolol, Molsidomine, Hexobarbital, Stiripentol, Saquinavir, Diazoxide, Bretylium, Obinutuzumab, Phenobarbital, Clarithromycin, Luliconazole, Itraconazole, Atazanavir, Rifapentine, Ivacaftor, Heptabarbital, Posaconazole, Simeprevir, Suvorexant, Thalidomide, Iobenguane, Amifostine, Fosphenytoin, Fosaprepitant, Enzalutamide, Darunavir, Ivabradine, Paraldehyde, Cobicistat, Fusidic acid, Nicorandil, Idelalisib, Siltuximab, Netupitant, Rufinamide, Ruxolitinib, Palbociclib, Rifampicin, Sodium oxybate, Deferasirox, Butobarbital, Nefazodone, Ceritinib, Ketoconazole, Perampanel, Methotrimeprazine, Dabrafenib"
Bethanechol,"Cimetropium, Nadolol"
Isosorbide mononitrate,"Fusidic acid, Ivacaftor, Palbociclib, Levodopa, Simeprevir, St. John's Wort, Dapoxetine, Idelalisib, Nitrous acid, Molsidomine, Siltuximab, Heptabarbital, Fosaprepitant, Tocilizumab, Dasatinib, Butobarbital, Dabrafenib, Luliconazole, Stiripentol, Nicorandil, Netupitant, Riociguat, Deferasirox, Hexobarbital"
Trichlormethiazide,"Alogliptin, Solifenacin, Doxercalciferol, Insulin aspart, Floctafenine, Levocabastine, Sertraline, Phenobarbital, Levocetirizine, Alfacalcidol, Aclidinium, Diphenoxylate, Oxybutynin, Flavoxate, Moclobemide, Calcium chloride, Gliclazide, Zuclopenthixol, Vortioxetine, Thiothixene, Cyclizine, Pramlintide, Tiotropium, Fenoterol, Ibuprofen, Albiglutide, Bromocriptine, Dexamethasone, Insulin degludec, Cholestyramine, Desipramine, Insulin glulisine, Orphenadrine, Olodaterol, Pioglitazone, Tolterodine, Enalaprilat, Oxymorphone, Cilazapril, Empagliflozin, Chlorpheniramine, Calcium gluconate, Tiaprofenic acid, Canagliflozin, Pizotifen, Clofedanol, Escitalopram, Dulaglutide, Doxepin, Dapagliflozin, Budesonide, Difenoxin, Dihydrocodeine, Calcipotriol, Butylscopolamine, Pirbuterol, Promethazine, Arformoterol, Sitagliptin, Liraglutide, Tolbutamide, Amobarbital, Indacaterol, Calcium citrate, Umeclidinium, Isocarboxazid, Saxagliptin, Exenatide, Diphenhydramine, Corticotropin, Pimozide, Lithium cation, Methscopolamine, Methotrimeprazine, Glipizide, Vilanterol, Clomipramine, Calcium carbonate, Fesoterodine, Ivabradine, Captopril, Insulin detemir, Dexchlorpheniramine maleate, Homatropine, Quetiapine, Diazoxide, Vilazodone, Tapentadol, Mepenzolate, Cortisone acetate"
Phylloquinone,"Mineral oil, Fibrinogen human, Acenocoumarol, Orlistat"
Felodipine,"Levodopa, Magnesium chloride, Obinutuzumab, Atosiban, Stiripentol, Ketoconazole, Phenobarbital, Itraconazole, Netupitant, Aripiprazole, Molsidomine, Vecuronium, Amobarbital, Fosphenytoin, Fosaprepitant, St. John's Wort, Diazoxide, Fusidic acid, Butobarbital, Calcium citrate, Simeprevir, Rifapentine, Hexobarbital, Calcium carbonate, Luliconazole, Magnesium oxide, Silodosin, Nicorandil, Rifampicin, Amifostine, Calcium gluconate, Palbociclib, Idelalisib, Posaconazole, Magnesium salicylate, Tocilizumab, Moxonidine, Magnesium hydroxide, Dasatinib, Terazosin, Yohimbine, Dabrafenib, Heptabarbital, Clarithromycin, Calcium chloride, Magnesium citrate, Pancuronium, Deferasirox, Dapoxetine, Melatonin, Siltuximab, Ivacaftor, Bepridil"
Mycophenolic acid,"Ofloxacin, Teriflunomide, Aluminum hydroxide, Magnesium oxide, Azlocillin, Cloxacillin, Calcium carbonate, Cholestyramine, Pivampicillin, Meticillin, Tofacitinib, Leflunomide, Magnesium citrate, Magnesium hydroxide, Dienogest, Sipuleucel-T, Amdinocillin, Magnesium salicylate, Gemifloxacin, Levofloxacin, Benzylpenicillin, Azidocillin, Valganciclovir, Rifampicin, Magnesium chloride, Isavuconazonium, Amoxicillin, Bacampicillin, Rifapentine, Rabeprazole, Procaine benzylpenicillin, Norfloxacin, Sparfloxacin, Pivmecillinam, Ticarcillin, Denosumab, Probenecid, Roflumilast"
Ketoconazole,"Crizotinib, Trabectedin, Zopiclone, Cabozantinib, Ledipasvir, Tofacitinib, Pazopanib, Olaparib, Ergometrine, Saquinavir, Calcium carbonate, Rifapentine, Atorvastatin, Ifosfamide, Lacosamide, Mirabegron, Lurasidone, Telaprevir, Artesunate, Edoxaban, Magnesium oxide, Zuclopenthixol, Fesoterodine, Fimasartan, Brentuximab vedotin, Sodium bicarbonate, Boceprevir, Apixaban, Ivacaftor, Lumacaftor, Bedaquiline, Parecoxib, Dabigatran etexilate, Lomitapide, Ceritinib, Rilpivirine, Dabrafenib, Budesonide, Riociguat, Vemurafenib, Ponatinib, Tasimelteon, Brinzolamide, Rifampicin, St. John's Wort, Idelalisib, Nilotinib, Trastuzumab emtansine, Cilostazol, Saxagliptin, Bosutinib, Eliglustat, Darunavir, Brexpiprazole, Docetaxel, Fosphenytoin, Drospirenone, Rifaximin, Nintedanib, Magnesium hydroxide, Etizolam, Amrinone, Flunarizine, Quetiapine, Axitinib, Retapamulin, Cabazitaxel, Aliskiren, Halofantrine, Nitrendipine, Elvitegravir, Avanafil, Colchicine, Pimozide, Sonidegib, Ruxolitinib, Etravirine, Siltuximab, Regorafenib, Dapoxetine, Sunitinib, Dronedarone, Vilazodone, Carbocisteine, Panobinostat, Rivaroxaban, Domperidone, Tegafur, Fingolimod, Prasugrel, Cobicistat, Rabeprazole, Oxybutynin, Simeprevir, Perhexiline, Isavuconazonium, Fosamprenavir, Choline C 11, Ticagrelor, Propafenone, Daclatasvir, Flibanserin, Praziquantel, Naloxegol, Dasatinib, Nifedipine, Iloperidone, Macitentan, Lopinavir, Ulipristal, Solifenacin, Tocilizumab, Maraviroc, Ospemifene, Acenocoumarol, Afatinib, Prenylamine, Pranlukast, Tolterodine, Dutasteride, Suvorexant, Ibrutinib, Deferasirox, Vorapaxar, Temsirolimus, Carvedilol, Ergoloid mesylate, Ivabradine, Palbociclib, Topotecan, Aluminum hydroxide, Lapatinib, Bepridil, Everolimus, Estazolam, Silodosin, Ixabepilone, Barnidipine, Dienogest, Romidepsin, Prucalopride, Aripiprazole, Nebivolol, Tolvaptan, Imidafenacin, Levomilnacipran"
Irbesartan,"Obinutuzumab, Yohimbine, Diazoxide, Aripiprazole, Heparin, Canagliflozin, Aliskiren, Amifostine, Drospirenone, Nicorandil, Hexobarbital, Moxonidine, Lithium cation, Dapoxetine, Tolvaptan, Levodopa, Molsidomine, Carvedilol, Butobarbital, Heptabarbital"
