Drug_Name,Interactions
Topiramate,"Levocetirizine, Zolpidem, Loratadine, Diclofenamide, Methscopolamine, Nimodipine, Carbamazepine, Diphenhydramine, Paraldehyde, Dicyclomine, Quinidine, Perphenazine, Promethazine, Protriptyline, Aclidinium, Atropine, Cyclizine, Thiothixene, Scopolamine, Dronabinol, Doxepin, Ipratropium, Olanzapine, Amitriptyline, Fesoterodine, Oxybutynin, Pramipexole, Haloperidol, Umeclidinium, Homatropine, Tranylcypromine, Rotigotine, Droperidol, Thioridazine, Magnesium sulfate, Flecainide, Phenelzine, Meclizine, Dimenhydrinate, Butylscopolamine, Amoxapine, Levonorgestrel, Ethanol, Etonogestrel, Tolterodine, Acetazolamide, Fluphenazine, Loxapine, Perampanel, Mianserin, Trihexyphenidyl, Risperidone, Brimonidine, Lithium cation, Prochlorperazine, Solifenacin, Metolazone, Nabilone, Azelastine, Promazine, Tiotropium, Hyoscyamine, Acetylsalicylic acid, Maprotiline, Isocarboxazid, Paroxetine, Clomipramine, Trifluoperazine, Brompheniramine, Fexofenadine, Glycopyrronium, Norethisterone, Fosphenytoin, Etacrynic acid, Desloratadine, Saxagliptin, Chlorthalidone, Orlistat, Olopatadine, Doxylamine, Mefloquine, Imipramine, Levocabastine, Clozapine, Triprolidine, Dienogest, Sodium oxybate, Medroxyprogesterone acetate, Trimipramine, Pimozide, Cetirizine, Zuclopenthixol, Bumetanide, Thalidomide, Darifenacin, Metyrosine, Methenamine, Chlorothiazide, Aripiprazole, Buprenorphine, Flupentixol, Suvorexant, Nortriptyline, Moclobemide, Carbinoxamine, Trichlormethiazide, Hydrochlorothiazide, Rufinamide, Methotrimeprazine, Clemastine, Furosemide, Chlorpromazine, Ulipristal, Propantheline, Hydroxyzine, Mepenzolate, Valproic acid, Metformin, Dexchlorpheniramine maleate, Orphenadrine, Cyclobenzaprine, Quetiapine, Cyproheptadine, Trimethobenzamide, Flavoxate, Cyclopentolate, Ethoxzolamide, Memantine, Tapentadol, Hydrocodone, Pizotifen, Indapamide, Primidone, Disopyramide, Desipramine, Cathinone, Procyclidine, Minocycline, Mirtazapine, Chlorpheniramine"
Cefmetazole,"Probenecid, Acenocoumarol, Warfarin"
Olmesartan,"Teriflunomide, Yohimbine, Secobarbital, Tolvaptan, Methylphenidate, Triamterene, Treprostinil, Colesevelam, Alfuzosin, Heptabarbital, Heparin, Trimethoprim, Risperidone, Quinine, Eltrombopag, Perindopril, Eplerenone, Primidone, Drospirenone, Tadalafil, Nicorandil, Tranylcypromine, Dapoxetine, Duloxetine, Butobarbital, Obinutuzumab, Moxonidine, Brimonidine, Lithium cation, Ardeparin, Pentoxifylline, Levodopa, Vardenafil, Aliskiren, Diazoxide, Hexobarbital, Pentobarbital, Ciprofloxacin, Molsidomine, Phenelzine, Canagliflozin, Methohexital, Amifostine"
Amsacrine,"Roflumilast, Metamizole, Pimecrolimus, Clozapine, Leflunomide, Tacrolimus, Denosumab, Sipuleucel-T, Tofacitinib"
Theophylline,"Chlormezanone, Formoterol, Dobutamine, Mestranol, Halazepam, Phenylephrine, Alprazolam, Allopurinol, Deferasirox, Carteolol, Norgestimate, Zileuton, Methimazole, Bexarotene, Cimetidine, Camazepam, Clorazepic acid, Abiraterone, Phenylpropanolamine, Levobunolol, Liothyronine, Metamfetamine, Carbamazepine, Methohexital, Phenmetrazine, Febuxostat, Potassium Iodide, Isoflurophate, Ofloxacin, Flunitrazepam, Ivacaftor, Dronabinol, Mephentermine, Estradiol, Flurazepam, Bromazepam, Ritodrine, Mifepristone, Oxazepam, Methoxamine, Riociguat, Nitrazepam, Ethinylestradiol, Dabrafenib, Fosaprepitant, Fusidic acid, Pentoxifylline, Isoniazid, Clobazam, Secobarbital, Tofisopam, Primidone, Clenbuterol, Dihydrotachysterol, Nadolol, Bisoprolol, Fenoterol, Pindolol, Indacaterol, Idelalisib, Hexobarbital, Propylthiouracil, Propranolol, Isoprenaline, Tocilizumab, Dopamine, Labetalol, Luliconazole, Teriflunomide, Peginterferon beta-1a, Heptabarbital, Fosphenytoin, Linezolid, Acetaminophen, Amobarbital, Clarithromycin, Norfloxacin, Oxymetazoline, Iobenguane, Nebivolol, Simeprevir, Norepinephrine, Bosentan, Metreleptin, Ciprofloxacin, Conivaptan, Doxofylline, Butobarbital, Batimastat, Pentobarbital, Metipranolol, Diazepam, Epinephrine, Clonazepam, Acebutolol, Aprepitant, Ethanol, Midazolam, St. John's Wort, Propafenone, Chlorphentermine, Vemurafenib, Desogestrel, Salmeterol, Estrone sulfate, Tedizolid phosphate, Netupitant, Benzphetamine, Clidinium, Atomoxetine, Carvedilol, Norethisterone, Palbociclib, Dasatinib, Terbutaline, Atenolol, Metaraminol, Cyproterone acetate, Siltuximab, Disulfiram, Thiabendazole, Pancuronium, Mitotane, Cloxazolam, Chlordiazepoxide, Quazepam, Penbutolol, Levothyroxine, Triazolam, Ethynodiol diacetate, Naphazoline, Olodaterol, Fludiazepam, Carbimazole, Ketazolam, Timolol, Quinine, Zafirlukast, Tipranavir, Liotrix, Mexiletine, Regadenoson, Sotalol, Methotrexate, Cinolazepam, Bendroflumethiazide, Drospirenone, Stiripentol, Adenosine, Lithium cation, Orciprenaline, Estazolam, Thyroid, porcine, Clotiazepam, Tizanidine"
Argatroban,"Omega-3 fatty acids, Phenprocoumon, Omacetaxine mepesuccinate, Treprostinil, Sulodexide, Heparin, Phenindione, Dasatinib, Dalteparin, Tibolone, Apixaban, Rivaroxaban, Sugammadex, Acetylsalicylic acid, Edetic acid, Acenocoumarol, Edoxaban, Enoxaparin, Deoxycholic acid, Progesterone, Citric acid, Obinutuzumab, Limaprost, Pentosan polysulfate, Dabigatran etexilate, Ridogrel, Ethyl biscoumacetate, Vorapaxar, Warfarin, Ibrutinib, Gestodene, Dydrogesterone, Fondaparinux, Tipranavir, Nintedanib, Deferasirox, Desogestrel"
Liothyronine,"Amitriptyline, Mestranol, Vortioxetine, Colestipol, Carbamazepine, Iodide I-131, Ciprofloxacin, Piracetam, Cholestyramine, Fosphenytoin, Calcium gluconate, Trimipramine, Paroxetine, Drospirenone, Sertraline, Clomipramine, Amoxapine, Calcium carbonate, Imipramine, Vilazodone, Norethisterone, Escitalopram, Ethinylestradiol, Ethynodiol diacetate, Desogestrel, Warfarin, Calcium citrate, Tolevamer, Estradiol, Aminophylline, Protriptyline, Acenocoumarol, Rifampicin, Estrone sulfate, Colesevelam, Norgestimate, Desipramine, Lanthanum carbonate, Fluoxetine, Doxepin, Nortriptyline, Calcium chloride"
Disopyramide,"Fosaprepitant, Acetohexamide, Bosentan, Stanolone, Procyclidine, Eluxadoline, Netupitant, Sparfloxacin, Paroxetine, Phenelzine, Ramosetron, Fingolimod, Tocilizumab, Dabrafenib, Pindolol, Ivacaftor, Insulin detemir, Stiripentol, Gliquidone, Timolol, Verapamil, Lidocaine, Potassium chloride, Etravirine, Rifampicin, Insulin aspart, Acebutolol, Chlorpropamide, Fosphenytoin, Tiotropium, Acetylsalicylic acid, Morphine, Linagliptin, Conivaptan, Fusidic acid, Luliconazole, Ipratropium, Insulin glulisine, Deferasirox, Carvedilol, Bisoprolol, Itopride, Propranolol, Siltuximab, Gliclazide, Propafenone, Idelalisib, Itraconazole, Nebivolol, Repaglinide, Cimetropium, Ketoconazole, Oxandrolone, Mifepristone, Ivabradine, St. John's Wort, Penbutolol, Saxagliptin, Aprepitant, Simeprevir, Testosterone, Glyburide, Pramlintide, Metformin, Dronabinol, Lurasidone, Tacrine, Umeclidinium, Alogliptin, Atenolol, Sulpiride, Bexarotene, Aclidinium, Amiodarone, Mitotane, Trichlormethiazide, Tranylcypromine, Vildagliptin, Telithromycin, Nadolol, Labetalol, Canagliflozin, Palbociclib, Phenobarbital, Carteolol, Tolbutamide, Clarithromycin"
Lidocaine,"Levobunolol, Teriflunomide, Mifepristone, Conivaptan, Ivacaftor, Stiripentol, Siltuximab, Mitotane, Palbociclib, Prilocaine, Dabrafenib, Tocilizumab, Acebutolol, Etravirine, Fusidic acid, Pindolol, Bendroflumethiazide, Mexiletine, Penbutolol, Bexarotene, Tizanidine, Carteolol, Bisoprolol, Propranolol, Carvedilol, Sotalol, Labetalol, Dasatinib, Deferasirox, Amiodarone, Simeprevir, Nitrous acid, Idelalisib, Technetium Tc-99m tilmanocept, Atenolol, Saquinavir, Netupitant, Bosentan, Telaprevir, Ibutilide, Nitric Oxide, Carbamazepine, Fosaprepitant, Aprepitant, Dronedarone, Luliconazole, Abiraterone, Timolol, Metipranolol, Vemurafenib, Nebivolol, Cyproterone acetate, Nadolol, St. John's Wort"
Pamidronic acid,"Meloxicam, Mefenamic acid, Celecoxib, Ramucirumab, Pomalidomide, Sunitinib, Piroxicam, Deferasirox, Kanamycin, Sulindac, Sorafenib, Naproxen, Etodolac, Oxaprozin, Tobramycin, Esomeprazole, Neomycin, Lenalidomide, Arbekacin, Netilmicin, Ketoprofen, Cabozantinib, Ribostamycin, Ketorolac, Lansoprazole, Streptomycin, Axitinib, Ibuprofen, Framycetin, Fenoprofen, Thalidomide, Diflunisal, Flurbiprofen, Floctafenine, Tolmetin, Pazopanib, Diclofenac, Gentamicin, Vandetanib, Tiaprofenic acid, Nabumetone, Rabeprazole, Omeprazole, Indomethacin, Regorafenib, Spectinomycin, Amikacin"
Clemastine,"Morphine, Sodium oxybate, Umeclidinium, Brimonidine, Perampanel, Trichlormethiazide, Aclidinium, Moclobemide, Paroxetine, Pramipexole, Orphenadrine, Hydrocodone, Benzylpenicilloyl polylysine, Metyrosine, Suvorexant, Hydroxyzine, Sulpiride, Minocycline, Methotrimeprazine, Cathinone, Mianserin, Dronabinol, Paraldehyde, Buprenorphine, Azelastine, Isocarboxazid, Tacrine, Doxylamine, Tranylcypromine, Magnesium sulfate, Mirabegron, Thalidomide, Pramlintide, Rufinamide, Potassium chloride, Ipratropium, Eluxadoline, Ethanol, Zolpidem, Rotigotine, Tiotropium, Droperidol, Phenelzine, Tapentadol, Nabilone, Procyclidine, Aripiprazole, Betahistine, Cimetropium, Itopride, Mirtazapine, Ramosetron"
Acarbose,"Sparfloxacin, Oxandrolone, Tranylcypromine, Testosterone, Digoxin, Paroxetine, Neomycin, Trichlormethiazide, Phenelzine, Stanolone, Acetylsalicylic acid"
Venlafaxine,"Fluspirilene, Benzquinamide, Siltuximab, Fencamfamin, Meloxicam, Prochlorperazine, Tolmetin, Treprostinil, Dopamine, Mitotane, Promazine, Droperidol, Norepinephrine, Stiripentol, Dexmedetomidine, Trifluoperazine, Nabumetone, Articaine, Fenoprofen, Acenocoumarol, Aripiprazole, Sertindole, Obinutuzumab, Sulodexide, Acetylsalicylic acid, Dipivefrin, Limaprost, Bexarotene, Simeprevir, Haloperidol, Fosaprepitant, Dabigatran etexilate, Metoclopramide, Glucosamine, Risperidone, Phenelzine, Chlormezanone, Ridogrel, Mefenamic acid, Ivacaftor, Abiraterone, Dihydrocodeine, Rivaroxaban, Idelalisib, Aprepitant, Deoxycholic acid, Diclofenac, Luliconazole, Pseudoephedrine, Etodolac, Propafenone, Voriconazole, Iobenguane, Tizanidine, Moclobemide, Acetophenazine, Piroxicam, Chlorpromazine, Flupentixol, Fluoxetine, Sulpiride, Molindone, Thioridazine, Fusidic acid, Mepivacaine, Dapoxetine, Levonordefrin, Floctafenine, Carphenazine, Ethyl biscoumacetate, Methotrimeprazine, Heparin, Ibuprofen, Conivaptan, Ethanol, Sulindac, Netupitant, Deferasirox, Edetic acid, Citric acid, St. John's Wort, Procarbazine, Phenprocoumon, Zuclopenthixol, Loxapine, Perphenazine, Linezolid, Phenindione, Pimozide, Naproxen, Ibrutinib, Indomethacin, Dabrafenib, Racepinephrine, Rasagiline, Enoxaparin, Isocarboxazid, Tiaprofenic acid, Mifepristone, Granisetron, Tranylcypromine, Oxaprozin, Mesoridazine, Brimonidine, Flurbiprofen, Trazodone, Pentosan polysulfate, Olanzapine, Clozapine, Pentoxifylline, Ketoprofen, Guanfacine, Tocilizumab, Dalteparin, Acepromazine, Warfarin, Ioflupane I-123, Remoxipride, Thiothixene, Triflupromazine, Ketorolac, Quetiapine, Methylene blue, Panobinostat, Ephedrine, Epinephrine, Paliperidone, Methyldopa, Dasatinib, Ritonavir, Amisulpride, Chlorprothixene, Selegiline, Fondaparinux, Diflunisal, Triprolidine, Clonidine, Palbociclib, Tedizolid phosphate, Apixaban, Fluphenazine, Omega-3 fatty acids, Bosentan, Ondansetron"
Amcinonide,"Ceritinib, Deferasirox, Corticorelin ovine triflutate"
Atomoxetine,"Tipranavir, Phendimetrazine, Procarbazine, Salmeterol, Abiraterone, Mifepristone, Metamfetamine, Labetalol, Benzphetamine, Orciprenaline, Metaraminol, Arformoterol, Tedizolid phosphate, Modafinil, Cobicistat, Dextroamphetamine, Panobinostat, Diethylpropion, Iobenguane, Paroxetine, Dyphylline, Aminophylline, Aripiprazole, Dopamine, Salbutamol, Methoxamine, Methylphenidate, Doxapram, Mephentermine, Oxymetazoline, Thioridazine, Clenbuterol, Rasagiline, Phenylephrine, Tranylcypromine, Triprolidine, Quinidine, Bupropion, Olodaterol, Cinacalcet, Propylhexedrine, Fenoterol, Isoprenaline, Ritodrine, Dexmethylphenidate, Epinephrine, Pirbuterol, Chlorphentermine, Dipivefrin, Stiripentol, Formoterol, Ephedrine, Moclobemide, Phenelzine, Methotrimeprazine, Phenylpropanolamine, Linezolid, Isocarboxazid, Darunavir, Cocaine, Selegiline, Pseudoephedrine, Lisdexamfetamine, Acebutolol, Armodafinil, Norepinephrine, Fluoxetine, Phenmetrazine, Dobutamine, Racepinephrine, Indacaterol, Naphazoline, Delavirdine, Terbutaline, Terbinafine, Ritonavir"
Bleomycin,"Tofacitinib, Leflunomide, Roflumilast, Tacrolimus, Pimecrolimus, Sipuleucel-T, Gemcitabine, Denosumab, Brentuximab vedotin"
Chlorambucil,"Roflumilast, Pimecrolimus, Clozapine, Sipuleucel-T, Tacrolimus, Metamizole, Leflunomide, Tofacitinib, Denosumab"
Raltitrexed,"Leucovorin, Levomefolic acid, Metamizole, Clozapine"
Etonogestrel,"Lumacaftor, Chlorpropamide, Artemether, Mycophenolic acid, Atazanavir, Citric acid, Repaglinide, Warfarin, Colesevelam, Hexobarbital, Butobarbital, Secobarbital, Methohexital, Voriconazole, Oxcarbazepine, Acitretin, Phenprocoumon, Linagliptin, Vildagliptin, Insulin glulisine, Bosentan, Human C1-esterase inhibitor, Saxagliptin, Fosaprepitant, Treprostinil, Primidone, Darunavir, Mifepristone, Phenindione, Tipranavir, Eslicarbazepine acetate, Dabrafenib, Glyburide, Heptabarbital, Heparin, Fosphenytoin, Edetic acid, Perampanel, Exenatide, Cobicistat, Acetohexamide, Fosamprenavir, Telaprevir, Insulin detemir, Boceprevir, Sulodexide, Selegiline, Aprepitant, Ethyl biscoumacetate, Sugammadex, Enoxaparin, Canagliflozin, Gliclazide, Griseofulvin, Pentobarbital, Efavirenz, Saquinavir, Insulin aspart, Bexarotene, Metformin, Alogliptin, Gliquidone, Thalidomide, Clobazam, Acenocoumarol, Metreleptin, Tranexamic acid, Carbamazepine, Dalteparin, Tolbutamide, Ulipristal, Flibanserin, Felbamate, Fondaparinux, Rifabutin, Lamotrigine, St. John's Wort, Prucalopride, Lopinavir"
Morphine,"Nadolol, Doxylamine, Brimonidine, Ramosetron, Trimipramine, Desipramine, Benzphetamine, Aclidinium, Pipotiazine, Metamfetamine, Pramipexole, Atropine, Protriptyline, Clomipramine, Clopidogrel, Dimenhydrinate, Mirtazapine, Moclobemide, Ipratropium, Mannitol, Hyoscyamine, Dexchlorpheniramine maleate, Doxepin, Bendroflumethiazide, Cyclopentolate, Indapamide, Tienilic acid, Fexofenadine, Minocycline, Droperidol, Haloperidol, Rifampicin, Eplerenone, Fluphenazine, Metyrosine, Verapamil, Homatropine, Amoxapine, Trihexyphenidyl, Cyclobenzaprine, Phenelzine, Loratadine, Sodium oxybate, Tolterodine, Rasagiline, Chlorpheniramine, Perampanel, Darifenacin, Tranylcypromine, Cyclizine, Paroxetine, Cyclothiazide, Naltrexone, Pentazocine, Procyclidine, Clozapine, Cathinone, Alvimopan, Levocetirizine, Codeine, Saquinavir, Maprotiline, Flavoxate, Trimethobenzamide, Metolazone, Chlorpromazine, Cetirizine, Procarbazine, Eluxadoline, Umeclidinium, Olanzapine, Suvorexant, Thiothixene, Quetiapine, Zolpidem, Trichlormethiazide, Thioridazine, Lisdexamfetamine, Hydrochlorothiazide, Chlorothiazide, Lumacaftor, Azelastine, Solifenacin, Bumetanide, Buprenorphine, Linezolid, Rifabutin, Hydroxyzine, Chlorthalidone, Vortioxetine, Diphenhydramine, Phendimetrazine, Furosemide, Methscopolamine, Promethazine, Loxapine, Chlordiazepoxide, Selegiline, Oxybutynin, Ethanol, Etacrynic acid, Tedizolid phosphate, Dicyclomine, Isocarboxazid, Nalbuphine, Butorphanol, Sertraline, Ammonium chloride, Imipramine, Tesmilifene, Hydrocodone, Pimozide, Vilazodone, Desloratadine, Zuclopenthixol, Clidinium, Paraldehyde, Trifluoperazine, Carbinoxamine, Pizotifen, Cyproheptadine, Difenoxin, Fluoxetine, Tapentadol, Acepromazine, Promazine, Triamterene, Risperidone, Triprolidine, Orphenadrine, Dextroamphetamine, Butylscopolamine, Hydroflumethiazide, Fesoterodine, Amitriptyline, Diphenoxylate, Methotrimeprazine, Fenoterol, Olopatadine, Ethoxzolamide, Perphenazine, Propantheline, Nortriptyline, Acetazolamide, Rotigotine, Flupentixol, Dronabinol, Scopolamine, Nabilone, Thalidomide, Tiotropium, Spironolactone, Clofedanol, Methazolamide, Magnesium sulfate, Glycopyrronium, Rifapentine, Meclizine, Prochlorperazine, Amiloride, Brompheniramine, Escitalopram, Levocabastine, Dexbrompheniramine, Mepenzolate, Rufinamide, Diclofenamide"
Ropivacaine,"Abiraterone, Technetium Tc-99m tilmanocept, Ciprofloxacin, Mexiletine, Vemurafenib, Propofol, Deferasirox"
Bupivacaine,"Metipranolol, Technetium Tc-99m tilmanocept, Nebivolol, Carvedilol, Penbutolol, Acebutolol, Propranolol, Nadolol, Pindolol, Sotalol, Carteolol, Timolol, Labetalol, Bisoprolol, Levobunolol, Atenolol"
Tenofovir disoproxil,"Fenoprofen, Mefenamic acid, Amikacin, Ribostamycin, Flurbiprofen, Valaciclovir, Didanosine, Arbekacin, Darunavir, Spectinomycin, Lopinavir, Tobramycin, Adefovir dipivoxil, Framycetin, Gentamicin, Netilmicin, Ganciclovir, Floctafenine, Tizanidine, Diclofenac, Streptomycin, Sulindac, Piroxicam, Atazanavir, Tolmetin, Tipranavir, Indomethacin, Diflunisal, Kanamycin, Meloxicam, Nabumetone, Valganciclovir, Etodolac, Telaprevir, Ledipasvir, Tiaprofenic acid, Naproxen, Ketorolac, Celecoxib, Cidofovir, Cobicistat, Neomycin, Acyclovir, Oxaprozin, Ketoprofen, Ibuprofen, Simeprevir"
Flucloxacillin,"Methotrexate, Gentamicin, Amikacin, Probenecid, Tobramycin, Kanamycin, Mycophenolate mofetil, Minocycline, Demeclocycline, Acenocoumarol, Piperacillin, Tetracycline, Streptomycin, Warfarin, Mycophenolic acid, Neomycin"
Tranexamic acid,"Levonorgestrel, Medroxyprogesterone acetate, Fibrinogen human, Tretinoin, Norethisterone, Dienogest"
Ertapenem,"Tacrolimus, Picosulfuric acid, Valproic acid, Probenecid"
Desogestrel,"Batimastat, Sulodexide, Gliquidone, Treprostinil, Nadroparin, Citric acid, Danaparoid, Phenprocoumon, Insulin detemir, Dalteparin, Fondaparinux, Heptabarbital, Simeprevir, Primidone, Enoxaparin, Glyburide, Acenocoumarol, Rivaroxaban, Dabigatran etexilate, Acetohexamide, Rifabutin, Colesevelam, Isoflurophate, Insulin aspart, Secobarbital, Alogliptin, Phenindione, Linagliptin, Anthrax immune globulin human, Chlorpropamide, Tolbutamide, Vildagliptin, Edetic acid, Heparin, Desirudin, St. John's Wort, Human C1-esterase inhibitor, Edoxaban, Metformin, Fludrocortisone, Lumacaftor, Bexarotene, Methohexital, Repaglinide, Tinzaparin, Eslicarbazepine acetate, Pentobarbital, Warfarin, Hexobarbital, Canagliflozin, Insulin glulisine, Apixaban, Butobarbital, Saxagliptin, Ulipristal, Ethyl biscoumacetate, Gliclazide"
Mitomycin,"Saquinavir, Roflumilast, Vincristine, Pimecrolimus, Verapamil, Denosumab, Tesmilifene, Metamizole, Vinblastine, Leflunomide, Vinorelbine, Lumacaftor, Clozapine, Tacrolimus, Sipuleucel-T, Vindesine, Tofacitinib"
Bexarotene,"Saxagliptin, Tamoxifen, Lurasidone, Zolpidem, Tetracycline, Dasatinib, Simvastatin, Artemether, Pimozide, Bedaquiline, Enzalutamide, Levonorgestrel, Rilpivirine, Trabectedin, Vilazodone, Daclatasvir, Escitalopram, Estrone sulfate, Cobicistat, Sunitinib, Pipotiazine, Tamsulosin, Isosorbide mononitrate, Midazolam, Clonazepam, Fesoterodine, Temsirolimus, Avanafil, Toremifene, Nateglinide, Everolimus, Buspirone, Regorafenib, Mirtazapine, Aminophylline, Gemfibrozil, Tofacitinib, Ifosfamide, Macitentan, Buprenorphine, Crizotinib, Riociguat, Nicardipine, Darunavir, Amiodarone, Bosutinib, Docetaxel, Zonisamide, Felodipine, Diazepam, Mefloquine, Armodafinil, Clorazepic acid, Tiagabine, Progesterone, Ceritinib, Alprazolam, Atazanavir, Losartan, Mifepristone, Simeprevir, Repaglinide, Verapamil, Oxycodone, Ketoconazole, Itraconazole, Pazopanib, Hydrocodone, Amlodipine, Tasimelteon, Rivaroxaban, Conivaptan, Apremilast, Ixabepilone, Haloperidol, Erlotinib, Ticagrelor, Vandetanib, Doxorubicin, Estradiol, Elvitegravir, Ibrutinib, Solifenacin, Ivabradine, Benzphetamine, Trazodone, Aprepitant, Oxytetracycline, Isavuconazonium, Vinblastine, Eliglustat, Diltiazem, Norgestimate, Clidinium, Quetiapine, Etravirine, Quinidine, Darifenacin, Apixaban, Roflumilast, Ethinylestradiol, Exemestane, Nefazodone, Efavirenz, Axitinib, Lopinavir, Paclitaxel, Aripiprazole, Sulfamethoxazole, Norethisterone, Isosorbide dinitrate, Ivacaftor, Atorvastatin, Ethosuximide, Modafinil, Chloroquine, Tacrolimus, Ixazomib, Hydroxyprogesterone caproate, Saquinavir, Guanfacine, Flibanserin, Panobinostat, Drospirenone, Porfimer sodium, Maraviroc, Imatinib, Ethynodiol diacetate, Cabazitaxel, Lapatinib, Nimodipine, Boceprevir, Eszopiclone, Cilostazol, Lansoprazole, Fosamprenavir, Flurazepam, Fentanyl, Zopiclone, Silodosin, Cyproterone acetate, Verteporfin, Medroxyprogesterone acetate, Clarithromycin, Triazolam, Nisoldipine, Ulipristal, Rabeprazole, Doxazosin, Etoposide, Trimethoprim, Olaparib, Naloxegol, Trimipramine, Telithromycin, Cabozantinib, Tipranavir, Nilotinib, Vemurafenib, Chlordiazepoxide, Bisoprolol, Dienogest, Isosorbide, Methadone, Palonosetron, Spiramycin, Vinorelbine, Mestranol, Delavirdine, Gefitinib, Metamizole, Irinotecan, Sirolimus, Telaprevir, Eplerenone, Ruxolitinib, Tolvaptan, Lomitapide, Primaquine, Felbamate, Lumefantrine, Tolterodine, Quinine, Palbociclib, Stiripentol, Carbamazepine, Teniposide, Alfuzosin, Flutamide, Ondansetron, Netupitant, Fosaprepitant, Carboplatin, Rolapitant, Brexpiprazole, Idelalisib, Dexamethasone, Abiraterone, Suvorexant, Vortioxetine, Ospemifene, Cobimetinib, Clozapine, Sonidegib, Vincristine, Praziquantel, Rifabutin, Ritonavir, Nifedipine, Dronedarone, Perampanel, Dantrolene"
Ibutilide,"Fingolimod, Propafenone, Mifepristone, Ivabradine"
Vindesine,"Ketoconazole, Fosamprenavir, Aprepitant, Delavirdine, Clozapine, Metamizole, Leflunomide, Tofacitinib, Isavuconazonium, Ritonavir, Cobicistat, Sipuleucel-T, Nilotinib, Denosumab, Crizotinib, Tacrolimus, Dronedarone, Diltiazem, Saquinavir, Imatinib, Idelalisib, Voriconazole, Boceprevir, Ceritinib, Telaprevir, Roflumilast, Pimecrolimus, Darunavir, Atazanavir, Posaconazole, Verapamil, Clarithromycin, Nefazodone, Itraconazole, Conivaptan, Mifepristone"
Chlorthalidone,"Sulpiride, Hydromorphone, Tadalafil, Paroxetine, Codeine, Butobarbital, Risperidone, Tolbutamide, Duloxetine, Orciprenaline, Amifostine, Pentazocine, Vildagliptin, Ethanol, Nalbuphine, Tranylcypromine, Mecamylamine, Methylphenidate, Toremifene, Oxycodone, Insulin glulisine, Ivabradine, Chlorpheniramine, Perindopril, Insulin detemir, Gliclazide, Fludrocortisone, Licorice, Meperidine, Phenelzine, Diazoxide, Acetohexamide, Obinutuzumab, Chlorpropamide, Levodopa, Oxcarbazepine, Hexobarbital, Treprostinil, Alfuzosin, Alogliptin, Vardenafil, Pentobarbital, Methadone, Digoxin, Acetylsalicylic acid, Sufentanil, Dihydrocodeine, Tapentadol, Quinine, Dihydrotachysterol, Carbamazepine, Oxymorphone, Fentanyl, Primidone, Moxonidine, Nicorandil, Lithium cation, Brimonidine, Butorphanol, Allopurinol, Cyclophosphamide, Heptabarbital, Secobarbital, Alfentanil, Buprenorphine, Saxagliptin, Linagliptin, Yohimbine, Glyburide, Repaglinide, Remifentanil, Pentoxifylline, Insulin aspart, Canagliflozin, Porfimer sodium, Hydrocodone, Gliquidone, Molsidomine, Methohexital, Levorphanol, Verteporfin, Colesevelam, Procyclidine, Dexketoprofen, Metformin"
Ethoxzolamide,"Oxycodone, Butorphanol, Pentazocine, Dextroamphetamine, Primidone, Dihydrocodeine, Sufentanil, Tapentadol, Levorphanol, Carbamazepine, Pseudoephedrine, Codeine, Dorzolamide, Buprenorphine, Meperidine, Memantine, Chlorpheniramine, Magnesium salicylate, Nalbuphine, Metformin, Methazolamide, Hydromorphone, Benzphetamine, Phendimetrazine, Acetylsalicylic acid, Triprolidine, Brinzolamide, Bismuth subsalicylate, Hydrocodone, Canagliflozin, Methadone, Metamfetamine, Lithium cation, Quinidine, Lisdexamfetamine, Acetazolamide, Salsalate, Remifentanil, Fosphenytoin, Methenamine, Fentanyl, Ephedrine, Diclofenamide, Alfentanil, Zonisamide, Oxymorphone, Flecainide"
Pentobarbital,"Candesartan cilexetil, Metipranolol, Mannitol, Rotigotine, Isosorbide mononitrate, Hydroxyzine, Droperidol, Mecamylamine, Levobunolol, Rifampicin, Doxepin, Penbutolol, Nimodipine, Moexipril, Ethanol, Guanfacine, Verapamil, Prenylamine, Nisoldipine, Pindolol, Rifabutin, Pramipexole, Rufinamide, Furosemide, Dienogest, Propranolol, Clomipramine, Diltiazem, Irbesartan, Amoxapine, Dinutuximab, Trichlormethiazide, Fosinopril, Azelastine, Captopril, Paraldehyde, Levonorgestrel, Lamotrigine, Methotrimeprazine, Ethinylestradiol, Benazepril, Bendroflumethiazide, Nabilone, Teniposide, Nitrendipine, Labetalol, Apraclonidine, Amiloride, Bepridil, Hydrochlorothiazide, Imipramine, Voriconazole, Empagliflozin, Rifapentine, Acebutolol, Primidone, Felodipine, Acetazolamide, Amyl Nitrite, Minocycline, Nicardipine, Brimonidine, Carvedilol, Perhexiline, Terazosin, Felbamate, Etacrynic acid, Canagliflozin, Lisinopril, Buprenorphine, Tizanidine, Carteolol, Amlodipine, Norgestimate, Medroxyprogesterone acetate, Drospirenone, Tapentadol, Griseofulvin, Mianserin, Mefloquine, Thalidomide, Protriptyline, Nesiritide, Aliskiren, Sotalol, Clevidipine, Dexmedetomidine, Trimipramine, Eprosartan, Enalaprilat, Propacetamol, Perindopril, Isosorbide, Indapamide, Quetiapine, Riociguat, Nortriptyline, Aminophylline, Isometheptene, Hydrocodone, Prazosin, Paroxetine, Enalapril, Nebivolol, Dronabinol, Amrinone, Amitriptyline, Diclofenamide, Estradiol, Meperidine, Trandolapril, Bretylium, Isosorbide dinitrate, Nitroprusside, Telmisartan, Dapagliflozin, Losartan, Spironolactone, Acenocoumarol, Bumetanide, Dipyridamole, Cilazapril, Zolpidem, Quinapril, Ulipristal, Atenolol, Papaverine, Timolol, Lercanidipine, Norethisterone, Metolazone, Methyldopa, Nifedipine, Magnesium sulfate, Azilsartan medoxomil, Methazolamide, Chlorothiazide, Bisoprolol, Metyrosine, Ethynodiol diacetate, Minoxidil, Suvorexant, Acetaminophen, Gabapentin, Metformin, Risedronic acid, Doxazosin, Sodium oxybate, Hydralazine, Orphenadrine, Desipramine, Warfarin, Clonidine, Doxylamine, Nitroglycerin, Valproic acid, Mirtazapine, Isoxsuprine, Somatostatin, Triamterene, Perampanel, Mestranol, Chloramphenicol, Nadolol, Eplerenone, Flunarizine"
