Drug_Name,Interactions
Fluorouracil,"Metronidazole, Sipuleucel-T, Gimeracil, Leflunomide, Tacrolimus, Tofacitinib, Lacosamide, Acenocoumarol, Ospemifene, Roflumilast, Bosentan, Carvedilol, Metamizole, Warfarin, Diclofenac, Fosphenytoin, Denosumab, Leucovorin, Parecoxib, Ramelteon"
Pyridostigmine,"Acetylcholine, Fludrocortisone, Nadolol, Dipyridamole, Atracurium besylate"
Desoximetasone,"Deferasirox, Ceritinib, Corticorelin ovine triflutate"
Zafirlukast,"Ceritinib, Warfarin, Bosentan, Aripiprazole, Amodiaquine, Carvedilol, Aminophylline, Acenocoumarol, Tizanidine, Mifepristone, Dabrafenib, Lumacaftor"
Propylthiouracil,"Iodide I-131, Warfarin, Aminophylline, Metamizole, Acenocoumarol"
Acetohydroxamic acid,Ethanol
Pentostatin,"Leflunomide, Denosumab, Fludarabine, Metamizole, Nelarabine, Sipuleucel-T, Roflumilast, Tacrolimus, Tofacitinib"
Methoxsalen,"Pomalidomide, Porfimer sodium, Agomelatine, Pirfenidone, Artesunate, Tasimelteon, Aripiprazole, Bendamustine, Tegafur, Rasagiline, Tizanidine, Pentoxifylline"
Piroxicam,"Deoxycholic acid, Streptomycin, Kanamycin, Acenocoumarol, Ceritinib, Dabigatran etexilate, Limaprost, Dasatinib, Lithium cation, Colesevelam, Mifepristone, Omega-3 fatty acids, Acetylsalicylic acid, Neomycin, Trichlormethiazide, Citric acid, Dexketoprofen, Ribostamycin, Tipranavir, Rivaroxaban, Floctafenine, Glucosamine, Netilmicin, Warfarin, Eplerenone, Probenecid, Sulodexide, Unoprostone, Dabrafenib, Pentoxifylline, Nadolol, Paroxetine, Spectinomycin, Fludrocortisone, Talniflumate, Porfimer sodium, Pentosan polysulfate, Heparin, Methotrexate, Tacrolimus, Deferasirox, Gentamicin, Omacetaxine mepesuccinate, Aliskiren, Obinutuzumab, Ethyl biscoumacetate, Pemetrexed, Apixaban, Fondaparinux, Edetic acid, Ridogrel, Tobramycin, Hydralazine, Dalteparin, Arbekacin, Ibrutinib, Balsalazide, Phenprocoumon, Lumacaftor, Perindopril, Morniflumate, Enoxaparin, Pralatrexate, Diclofenac, Drospirenone, Sparfloxacin"
Lamotrigine,"Silodosin, Magnesium hydroxide, Terazosin, Buprenorphine, Phenoxybenzamine, Rifapentine, Clarithromycin, Dienogest, Magnesium citrate, Voriconazole, Azelastine, Tapentadol, Amobarbital, Paraldehyde, Tamsulosin, Rifabutin, Norethisterone, Medroxyprogesterone acetate, Telithromycin, Rotigotine, Fosphenytoin, Calcium chloride, Magnesium salicylate, Rocuronium, Methotrimeprazine, Rifampicin, Minocycline, Clopidogrel, Doxazosin, Atazanavir, Hydrocodone, Ethanol, Atracurium besylate, Hydroxyzine, Calcium gluconate, Magnesium oxide, Calcium citrate, Vecuronium, Orphenadrine, Pancuronium, Primidone, Suvorexant, Phenobarbital, Ketoconazole, Cisatracurium, Calcium carbonate, Magnesium chloride, Magnesium sulfate, Ezogabine, Butobarbital, Perampanel, Heptabarbital, Phentolamine, Hexobarbital, Thalidomide, Rufinamide, Nafcillin, Efavirenz, Procainamide, Metyrosine, Orlistat, Sodium oxybate, Paroxetine, Mianserin, Carbamazepine, Itraconazole, Posaconazole"
Perflutren,"Ivabradine, Mifepristone"
Hydroxyzine,"Hydrocodone, Potassium chloride, Efavirenz, Dimenhydrinate, Pipotiazine, Guanfacine, Flunarizine, Orphenadrine, Itopride, Bromazepam, Levorphanol, Brexpiprazole, Perampanel, Paroxetine, Cyclobenzaprine, Rotigotine, Heptabarbital, Aripiprazole, Midazolam, Diazepam, Lurasidone, Maprotiline, Fosphenytoin, Scopolamine, Butobarbital, Rufinamide, Amobarbital, Desipramine, Flibanserin, Tasimelteon, Ziconotide, Primidone, Fluphenazine, Olopatadine, Ezogabine, Thalidomide, Meclizine, Cimetropium, Ramelteon, Pramlintide, Zaleplon, Suvorexant, Zonisamide, Betahistine, Levetiracetam, Tapentadol, Diphenhydramine, Butylscopolamine, Desflurane, Perphenazine, Levocabastine, Levocetirizine, Tizanidine, Propofol, Ramosetron, Mianserin, Oxazepam, Clomipramine, Brompheniramine, Isoflurane, Mifepristone, Triazolam, Fentanyl, Ethotoin, Methsuximide, Chlorpheniramine, Vigabatrin, Remifentanil, Butorphanol, Flurazepam, Gabapentin enacarbil, Paraldehyde, Ethosuximide, Carbinoxamine, Thiothixene, Metyrosine, Buprenorphine, Zopiclone, Benzylpenicilloyl polylysine, Metaxalone, Pomalidomide, Clonazepam, Clonidine, Ethanol, Hexobarbital, Quazepam, Eluxadoline, Oxymorphone, Gabapentin, Aclidinium, Risperidone, Cyclizine, Magnesium sulfate, Trifluoperazine, Trimipramine, Dexchlorpheniramine maleate, Felbamate, Umeclidinium, Sufentanil, Nitrazepam, Pentazocine, Methotrimeprazine, Estazolam, Promethazine, Nitrous oxide, Mirabegron, Dantrolene, Doxepin, Nalbuphine, Minocycline, Carbamazepine, Tiotropium, Azelastine, Stiripentol, Cathinone, Clorazepic acid, Pizotifen, Sodium oxybate, Trichlormethiazide, Ketamine, Desloratadine, Tiagabine, Fexofenadine, Alfentanil, Phenobarbital, Sevoflurane"
Bosentan,"Chloroquine, Tasimelteon, Gemfibrozil, Clorazepic acid, Tofacitinib, Trimipramine, Quinidine, Doxorubicin, Dexamethasone, Carbamazepine, Regorafenib, Tolvaptan, Everolimus, Tamoxifen, Isosorbide mononitrate, Itraconazole, Perampanel, Tipranavir, Eltrombopag, Simvastatin, Imatinib, Clarithromycin, Etoposide, Saquinavir, Nateglinide, Fluvastatin, Diazepam, Abiraterone, Rolapitant, Felodipine, Stiripentol, Capecitabine, Dantrolene, Dasatinib, Buprenorphine, Hydrocodone, Conivaptan, Norethisterone, Isosorbide, Maraviroc, Ticagrelor, Irbesartan, Triazolam, Simeprevir, Zopiclone, Bisoprolol, Dronedarone, Estrone sulfate, Doxazosin, Mifepristone, Pitavastatin, Irinotecan, Medroxyprogesterone acetate, Docetaxel, Tamsulosin, Flurazepam, Verapamil, Darunavir, Ondansetron, Apremilast, Benzphetamine, Tetracycline, Zonisamide, Paclitaxel, Nicardipine, Tadalafil, Efavirenz, Vortioxetine, Sonidegib, Acenocoumarol, Midazolam, Aprepitant, Vilazodone, Glyburide, Pazopanib, Pipotiazine, Panobinostat, Ketoconazole, Exemestane, Pimozide, Tolbutamide, Temsirolimus, Silodosin, Saxagliptin, Hydroxyprogesterone caproate, Aminophylline, Axitinib, Eplerenone, Dienogest, Apixaban, Roflumilast, Fentanyl, Vinblastine, Trabectedin, Losartan, Tolterodine, Cilostazol, Atazanavir, Ixazomib, Posaconazole, Nifedipine, Olaparib, Sunitinib, Ospemifene, Warfarin, Escitalopram, Ethosuximide, Primaquine, Ceritinib, Palbociclib, Ixabepilone, Guanfacine, Leflunomide, Rifampicin, Tacrolimus, Telithromycin, Teriflunomide, Isosorbide dinitrate, Boceprevir, Estradiol, Tiagabine, Isavuconazonium, Bosutinib, Fosaprepitant, Cabazitaxel, Flibanserin, Rabeprazole, Eliglustat, Ivabradine, Quetiapine, Riociguat, Ivacaftor, Daclatasvir, Nilotinib, Brexpiprazole, Spiramycin, Crizotinib, Nefazodone, Ulipristal, Cobicistat, Felbamate, Rifabutin, Aripiprazole, Macitentan, Rivaroxaban, Vemurafenib, Ruxolitinib, Bedaquiline, Armodafinil, Modafinil, Etravirine, Voriconazole, Fosamprenavir, Amiodarone, Vandetanib, Praziquantel, Suvorexant, Rilpivirine, Solifenacin, Lurasidone, Vardenafil, Idelalisib, Atorvastatin, Elvitegravir, Ibrutinib, Lomitapide, Cabozantinib, Fesoterodine, Naloxegol, Lopinavir, Ifosfamide, Clonazepam, Telaprevir, Cyproterone acetate, Delavirdine, Trazodone, Avanafil, Lapatinib, Enzalutamide, Repaglinide, Sirolimus"
Tigecycline,Warfarin
Doxapram,"Procarbazine, Iobenguane, Tranylcypromine, Orciprenaline, Ritodrine, Acebutolol, Chlorphentermine, Naphazoline, Oxymetazoline, Rasagiline, Doxofylline, Formoterol, Moclobemide, Isocarboxazid, Dobutamine, Phenmetrazine, Metaraminol, Linezolid, Isoprenaline, Metamfetamine, Mephentermine, Epinephrine, Clenbuterol, Phenelzine, Dopamine, Labetalol, Salmeterol, Fenoterol, Methoxamine, Selegiline, Tedizolid phosphate, Terbutaline, Benzphetamine"
Methotrexate,"Nafcillin, Mefenamic acid, Denosumab, Sulindac, Bismuth subsalicylate, Probenecid, Bacampicillin, Sulfasalazine, Fenoprofen, Ibuprofen, Verapamil, Rolapitant, Dyphylline, Cloxacillin, Magnesium salicylate, Ticarcillin, Tesmilifene, Etodolac, Diflunisal, Mezlocillin, Benzylpenicillin, Esomeprazole, Leflunomide, Floctafenine, Oxaprozin, Fosphenytoin, Flurbiprofen, Tofacitinib, Tiaprofenic acid, Pivmecillinam, Eltrombopag, Roflumilast, Ketoprofen, Pivampicillin, Colesevelam, Diclofenac, Procaine benzylpenicillin, Acetylsalicylic acid, Cholestyramine, Metamizole, Amoxicillin, Amdinocillin, Hetacillin, Aminophylline, Furosemide, Bumetanide, Azidocillin, Tacrolimus, Meloxicam, Mipomersen, Teriflunomide, Carbenicillin, Salsalate, Lumacaftor, Dexketoprofen, Naproxen, Rabeprazole, Etacrynic acid, Sipuleucel-T, Azlocillin, Oxacillin, Tegafur, Meticillin, Cyclacillin, Saquinavir"
Carbamazepine,"Etravirine, Mitotane, Thalidomide, Propafenone, Verapamil, Hydrocortisone, Desipramine, Propranolol, Canagliflozin, Dexamethasone, Cobicistat, Conivaptan, Exemestane, Ibrutinib, Delavirdine, Dronedarone, Suvorexant, Risperidone, Perampanel, Flunarizine, Itraconazole, Apixaban, Lithium cation, St. John's Wort, Orlistat, Crizotinib, Prednisone, Selegiline, Panobinostat, Regorafenib, Mianserin, Nilotinib, Felbamate, Estrone sulfate, Azelastine, Estradiol, Artemether, Cannabidiol, Fentanyl, Daclatasvir, Palbociclib, Zaleplon, Eslicarbazepine acetate, Acetazolamide, Olaparib, Hydrocodone, Vemurafenib, Prednisolone, Hydrochlorothiazide, Ledipasvir, Nefazodone, Tolvaptan, Efavirenz, Dasatinib, Minocycline, Ivabradine, Vandetanib, Paroxetine, Nifedipine, Fingolimod, Sunitinib, Enzalutamide, Dabrafenib, Warfarin, Pirfenidone, Rolapitant, Pomalidomide, Everolimus, Roflumilast, Metamizole, Ixabepilone, Oxcarbazepine, Flibanserin, Isavuconazonium, Macitentan, Fusidic acid, Indapamide, Sofosbuvir, Netupitant, Dienogest, Rasagiline, Sodium oxybate, Fosamprenavir, Ceritinib, Bazedoxifene, Guanfacine, Linezolid, Metyrosine, Thiothixene, Rufinamide, Mifepristone, Aripiprazole, Magnesium sulfate, Nintedanib, Clarithromycin, Darunavir, Fludrocortisone, Methylprednisolone, Ponatinib, Fosphenytoin, Paliperidone, Imatinib, Danazol, Temsirolimus, Pazopanib, Bepridil, Riluzole, Naloxegol, Phenelzine, Telaprevir, Aminophylline, Diclofenamide, Ivacaftor, Ulipristal, Tasimelteon, Rivaroxaban, Luliconazole, Etoposide, Lurasidone, Tranylcypromine, Medroxyprogesterone acetate, Mebendazole, Drospirenone, Methazolamide, Stiripentol, Saxagliptin, Tofacitinib, Deferasirox, Norethisterone, Lacosamide, Dacarbazine, Rilpivirine, Vortioxetine, Batimastat, Zuclopenthixol, Lopinavir, Sonidegib, Thyroid, porcine, Trifluoperazine, Vecuronium, Chlorothiazide, Atazanavir, Tocilizumab, Simeprevir, Voriconazole, Trichlormethiazide, Moclobemide, Eliglustat, Lumefantrine, Diclofenac, Buprenorphine, Saquinavir, Acenocoumarol, Axitinib, Bosutinib, Telithromycin, Maraviroc, Vorapaxar, Cabozantinib, Norgestimate, Liotrix, Elvitegravir, Doxorubicin, Tapentadol, Doxepin, Asenapine, Orphenadrine, Clomipramine, Brentuximab vedotin, Lapatinib, Irinotecan, Bedaquiline, Linagliptin, Abiraterone, Dolutegravir, Sertraline, Propacetamol, Brexpiprazole, Trabectedin, Isoniazid, Tipranavir, Isocarboxazid, Escitalopram, Adenosine, Nicardipine, Idelalisib, Procarbazine, Quetiapine, Rotigotine, Pimozide, Methotrimeprazine, Ticagrelor, Praziquantel, Ezogabine, Vilazodone, Afatinib, Tadalafil, Siltuximab, Paraldehyde, Bendamustine, Boceprevir, Tedizolid phosphate, Ethanol, Isoflurophate, Romidepsin, Dabigatran etexilate, Felodipine, Apremilast"
Cisatracurium,"Tobramycin, Clindamycin, Magnesium sulfate, Quinidine, Polymyxin B, Perhexiline, Isoflurane, Bepridil, Felodipine, Risedronic acid, Ribostamycin, Arbekacin, Fludrocortisone, Verapamil, Colistimethate, Lithium cation, Spectinomycin, Prenylamine, Streptomycin, Neomycin, Procainamide, Gentamicin, Lincomycin, Amrinone, Netilmicin, Minocycline, Flunarizine, Kanamycin, Oxytetracycline, Nitrendipine, Gabapentin, Nicardipine"
Cephalexin,"Zinc, Acenocoumarol, Picosulfuric acid, Warfarin, Zinc gluconate, Probenecid, Zinc sulfate"
Fondaparinux,"Heparin, Floctafenine, Edoxaban, Desvenlafaxine, Cilostazol, Dasatinib, Dalteparin, Magnesium salicylate, Vorapaxar, Estrone sulfate, Sugammadex, Sertraline, Dienogest, Vortioxetine, Norgestimate, Gestodene, Tibolone, Flurbiprofen, Etodolac, Warfarin, Oxaprozin, Tinzaparin, Mestranol, Ticagrelor, Pentosan polysulfate, Meloxicam, Deoxycholic acid, Nadroparin, Icosapent ethyl, Naproxen, Clopidogrel, Edetic acid, Iloprost, Tiaprofenic acid, Apixaban, Obinutuzumab, Epoprostenol, Ethyl biscoumacetate, Acetylsalicylic acid, Paroxetine, Enoxaparin, Estradiol, Fenoprofen, Sulindac, Desirudin, Bismuth subsalicylate, Norethisterone, Ibrutinib, Tipranavir, Cangrelor, Deferasirox, Phenprocoumon, Citric acid, Dabigatran etexilate, Ethynodiol diacetate, Dihydrocodeine, Rivaroxaban, Omacetaxine mepesuccinate, Sulodexide, Mefenamic acid, Dipyridamole, Acenocoumarol, Escitalopram, Salsalate, Prasugrel, Diclofenac, Limaprost, Vilazodone, Milnacipran, Ridogrel, Danaparoid, Medroxyprogesterone acetate, Diflunisal, Cyproterone acetate, Hydroxyprogesterone caproate, Levomilnacipran, Omega-3 fatty acids, Tirofiban, Nintedanib, Drospirenone, Omega-3-acid ethyl esters, Ethinylestradiol, Ketoprofen, Ibuprofen"
Vinblastine,"Aprepitant, Afatinib, Mifepristone, Idelalisib, Mitotane, Luliconazole, Ivacaftor, Palbociclib, Leflunomide, Stiripentol, Posaconazole, Voriconazole, Aripiprazole, Simeprevir, Dasatinib, Itraconazole, Ledipasvir, St. John's Wort, Tacrolimus, Saquinavir, Sofosbuvir, Brentuximab vedotin, Deferasirox, Tolterodine, Metamizole, Roflumilast, Denosumab, Dabrafenib, Fosaprepitant, Phenelzine, Sipuleucel-T, Netupitant, Fusidic acid, Siltuximab, Linagliptin, Tofacitinib, Tocilizumab, Clarithromycin, Verapamil, Tesmilifene, Doxorubicin, Conivaptan, Dabigatran etexilate, Lopinavir, Tranylcypromine"
Propranolol,"Vemurafenib, Rivastigmine, Acetylcholine, Methacholine, Saquinavir, Zileuton, Pazopanib, Moxonidine, Rizatriptan, Naloxegol, Tranylcypromine, Tizanidine, Tofacitinib, Silodosin, Diazoxide, Teriflunomide, Risperidone, Paroxetine, Quinidine, Brentuximab vedotin, Pentoxifylline, Propafenone, Cholestyramine, Molsidomine, Floctafenine, Dabigatran etexilate, Aripiprazole, Dronedarone, Ivabradine, Acepromazine, Butobarbital, Doxofylline, Darunavir, Prucalopride, Regorafenib, Abiraterone, Orciprenaline, Vardenafil, Levodopa, Sufentanil, Ledipasvir, Bosutinib, Ceritinib, Doxorubicin, Chlorpropamide, Colchicine, Lacidipine, Panobinostat, Tadalafil, Dipyridamole, Edoxaban, Topotecan, Amiodarone, Colesevelam, Yohimbine, Verapamil, Ethanol, Lacosamide, Primidone, Hexobarbital, Ruxolitinib, Deferasirox, Chloroquine, Bretylium, Everolimus, Amifostine, Fingolimod, Cobicistat, Heptabarbital, Nifedipine, Afatinib, Rifaximin, Nicorandil, Phenelzine, Cyproterone acetate, Mepivacaine, Obinutuzumab"
Atropine,"Potassium chloride, Eluxadoline, Rasagiline, Tedizolid phosphate, Selegiline, Cimetropium, Ramosetron, Trichlormethiazide, Isocarboxazid, Itopride, Tranylcypromine, Paroxetine, Aclidinium, Mianserin, Azelastine, Phenelzine, Tiotropium, Mirabegron, Pramlintide, Linezolid, Moclobemide, Ethanol, Umeclidinium, Procarbazine"
Fenoprofen,"Edetic acid, Obinutuzumab, Acenocoumarol, Ridogrel, Rivaroxaban, Deferasirox, Apixaban, Kanamycin, Netilmicin, Warfarin, Porfimer sodium, Limaprost, Morniflumate, Pentosan polysulfate, Citric acid, Unoprostone, Dabigatran etexilate, Eplerenone, Omega-3 fatty acids, Trichlormethiazide, Fludrocortisone, Aliskiren, Talniflumate, Pentoxifylline, Acetylsalicylic acid, Pralatrexate, Glucosamine, Heparin, Sulodexide, Floctafenine, Probenecid, Tacrolimus, Ethyl biscoumacetate, Gentamicin, Dalteparin, Diclofenac, Nadolol, Tipranavir, Arbekacin, Omacetaxine mepesuccinate, Sparfloxacin, Lithium cation, Enoxaparin, Streptomycin, Balsalazide, Spectinomycin, Deoxycholic acid, Colesevelam, Ibrutinib, Pemetrexed, Ribostamycin, Drospirenone, Neomycin, Paroxetine, Dasatinib, Tobramycin, Phenprocoumon, Hydralazine, Perindopril, Dexketoprofen"
Clonidine,"Pentoxifylline, Risperidone, Rotigotine, Rufinamide, Metyrosine, Iobenguane, Primidone, Tadalafil, Tranylcypromine, Verapamil, Thalidomide, Magnesium sulfate, Paroxetine, Ivabradine, Bretylium, Heptabarbital, Vardenafil, Nadolol, Bepridil, Paraldehyde, Yohimbine, Diazoxide, Orphenadrine, Lacosamide, Moxonidine, Ceritinib, Phenelzine, Nicorandil, Molsidomine, Obinutuzumab, Buprenorphine, Suvorexant, Hexobarbital, Perampanel, Hydrocodone, Amifostine, Azelastine, Ruxolitinib, Sodium oxybate, Methotrimeprazine, Tofacitinib, Ethanol, Tapentadol, Butobarbital, Levodopa, Minocycline"
Valaciclovir,"Mycophenolate mofetil, Mycophenolic acid"
Carbenicillin,"Tobramycin, Neomycin, Mycophenolic acid, Warfarin, Probenecid, Streptomycin, Demeclocycline, Mycophenolate mofetil, Kanamycin, Gentamicin, Tetracycline, Minocycline, Acenocoumarol"
Voriconazole,"Nicardipine, Ruxolitinib, Cobicistat, Ergoloid mesylate, Alosetron, Fludrocortisone, Esomeprazole, Barnidipine, Levomilnacipran, Prednisone, Methylprednisolone, Ivacaftor, Lumacaftor, Docetaxel, Tadalafil, Fosamprenavir, Cabazitaxel, Guanfacine, Vemurafenib, Cilostazol, Dienogest, Ospemifene, Rabeprazole, Panobinostat, Acenocoumarol, Conivaptan, Tolvaptan, Halofantrine, Oxybutynin, Sunitinib, Isavuconazonium, Losartan, Levobupivacaine, Sirolimus, Zopiclone, Trabectedin, Eplerenone, Ceritinib, Didanosine, Propafenone, Tacrolimus, Heptabarbital, Ivabradine, Dutasteride, Warfarin, Fluticasone propionate, Dasatinib, Dronedarone, Paricalcitol, Lapatinib, Lopinavir, Almotriptan, Felodipine, Rifapentine, Meloxicam, Maraviroc, Enzalutamide, Darunavir, Glyburide, Ponatinib, Busulfan, Crizotinib, Tamsulosin, Repaglinide, Ramelteon, Ticagrelor, Bosutinib, Clopidogrel, Pranlukast, Primidone, Boceprevir, Gliclazide, Atazanavir, Amobarbital, Apixaban, Ixabepilone, Lacosamide, Parecoxib, Sonidegib, Retapamulin, Axitinib, Etravirine, Glipizide, Naloxegol, Romidepsin, Silodosin, Imatinib, Prenylamine, Simvastatin, Trastuzumab emtansine, Butobarbital, Quetiapine, Porfimer sodium, Norethisterone, Avanafil, Luliconazole, Cabozantinib, Ergotamine, Tasimelteon, Iloperidone, Cisapride, Salmeterol, Etizolam, Ulipristal, Vardenafil, Dabrafenib, Vilazodone, Hexobarbital, Gabapentin, Flibanserin, Fosphenytoin, Pazopanib, Ifosfamide, Chlorpropamide, Palbociclib, Regorafenib, Tofacitinib, Nitrendipine, Medroxyprogesterone acetate, Macitentan, St. John's Wort, Quinidine, Saxagliptin, Olaparib, Amrinone, Ibrutinib, Vorapaxar, Solifenacin, Zuclopenthixol, Fesoterodine, Prasugrel, Astemizole, Aripiprazole, Eliglustat, Drospirenone, Telaprevir, Carvedilol, Diclofenac, Mifepristone, Elvitegravir, Imidafenacin, Doxorubicin, Bedaquiline, Colchicine, Suvorexant, Lomitapide, Daclatasvir, Verapamil, Magnesium sulfate, Rifampicin, Brinzolamide, Pimozide, Domperidone, Phenobarbital, Fentanyl, Atorvastatin, Bepridil, Irinotecan, Nilotinib, Rilpivirine, Brentuximab vedotin, Brexpiprazole, Efavirenz, Ibuprofen, Estazolam, Rifabutin, Prednisolone, Lurasidone, Simeprevir, Idelalisib, Hydrocodone, Risedronic acid, Tolterodine, Ergometrine, Perhexiline, Everolimus, Amphotericin B, Tolazamide, Flunarizine, Dapoxetine, Budesonide"
Levocarnitine,"Acenocoumarol, Warfarin"
Enalapril,"Drospirenone, Trichlormethiazide, Canagliflozin, Sacubitril, Eplerenone, Levodopa, Tadalafil, Azathioprine, Moxonidine, Temsirolimus, Butobarbital, Sirolimus, Dapoxetine, Nicorandil, Vardenafil, Amifostine, Sodium aurothiomalate, Primidone, Lithium cation, Heparin, Heptabarbital, Obinutuzumab, Iron Dextran, Tolvaptan, Risperidone, Everolimus, Phenelzine, Molsidomine, Yohimbine, Aprotinin, Tranylcypromine, Diazoxide, Acetylsalicylic acid, Hexobarbital, Tizanidine, Iron, Aliskiren, Sitagliptin, Icatibant, Pentoxifylline"
Nizatidine,"Iron Dextran, Rilpivirine, Nilotinib, Risedronic acid, Ledipasvir, Dexmethylphenidate, Posaconazole, Varenicline, Ketoconazole, Atazanavir, Delavirdine, Itraconazole, Fosamprenavir, Cefuroxime, Dabrafenib, Cefditoren, Pazopanib, Cysteamine, Bosutinib, Saquinavir, Cefpodoxime, Dasatinib"
Diclofenac,"Gentamicin, Enoxaparin, Mefenamic acid, Trichlormethiazide, Primidone, Dasatinib, Tiaprofenic acid, Phenprocoumon, Neomycin, Talniflumate, Heparin, Omega-3 fatty acids, Balsalazide, Morniflumate, Fludrocortisone, Aprepitant, Ibrutinib, Oxaprozin, Pentosan polysulfate, Pemetrexed, Spectinomycin, Ethyl biscoumacetate, Tacrolimus, Deferasirox, Etodolac, Colesevelam, Unoprostone, Apixaban, Arbekacin, Diflunisal, Dabigatran etexilate, Drospirenone, Flurbiprofen, Ribostamycin, Limaprost, Meloxicam, Paroxetine, Omacetaxine mepesuccinate, Fosphenytoin, Floctafenine, Sparfloxacin, Pentoxifylline, Tobramycin, Pralatrexate, Rifapentine, Kanamycin, Tipranavir, Sulindac, Rifampicin, Nadolol, Tizanidine, Gemfibrozil, Ibuprofen, Streptomycin, Aliskiren, Perindopril, Warfarin, Ketoprofen, Hydralazine, Lithium cation, Porfimer sodium, Netilmicin, Capecitabine, Glucosamine, Phenobarbital, Probenecid, Rivaroxaban, Eplerenone, Obinutuzumab, Deoxycholic acid, Ridogrel, Acenocoumarol, Edetic acid, Dalteparin, Acetylsalicylic acid, Citric acid, Deferiprone, Tolbutamide, Sulodexide, Dexketoprofen, Delavirdine, Naproxen, Nicardipine"
Fluticasone propionate,"Cimetropium, Mephentermine, Tranylcypromine, Isoprenaline, Naphazoline, Formoterol, Fenoterol, Dobutamine, Cobicistat, Ceritinib, Tipranavir, Nadolol, Methoxamine, Orciprenaline, Telithromycin, Dopamine, Chlorphentermine, Lopinavir, Labetalol, Telaprevir, Ketoconazole, Saquinavir, Eluxadoline, Metamfetamine, Phenelzine, Terbutaline, Oxymetazoline, Ethanol, Doxofylline, Darunavir, Paroxetine, Benzphetamine, Cathinone, Metaraminol, Trichlormethiazide, Clarithromycin, Itraconazole, Clenbuterol, Idelalisib, Epinephrine, Ramosetron, Tacrolimus, Acebutolol, Posaconazole, Phenmetrazine, Ritodrine, Fusidic acid, Atazanavir, Nefazodone, Iobenguane, Salmeterol, Boceprevir"
Doxazosin,"Amifostine, Flunarizine, Simeprevir, Levodopa, Fusidic acid, St. John's Wort, Nicardipine, Primidone, Molsidomine, Amrinone, Tocilizumab, Pentoxifylline, Obinutuzumab, Prenylamine, Moxonidine, Diazoxide, Risedronic acid, Verapamil, Nadolol, Netupitant, Mifepristone, Hexobarbital, Idelalisib, Aprepitant, Tadalafil, Nicorandil, Luliconazole, Mitotane, Dapoxetine, Vardenafil, Yohimbine, Palbociclib, Magnesium sulfate, Ivacaftor, Bepridil, Nitrendipine, Dasatinib, Fosaprepitant, Heptabarbital, Siltuximab, Felodipine, Phenelzine, Dabrafenib, Tranylcypromine, Boceprevir, Butobarbital, Gabapentin, Conivaptan, Deferasirox, Perhexiline, Risperidone, Stiripentol"
Fluocinolone acetonide,"Deferasirox, Corticorelin ovine triflutate, Ceritinib"
Ethosuximide,"Fosaprepitant, Idelalisib, Metamfetamine, Palbociclib, Fusidic acid, Methotrimeprazine, Orphenadrine, Dabrafenib, Dasatinib, Netupitant, Mianserin, Mifepristone, Thalidomide, Conivaptan, Simeprevir, Hydrocodone, Benzphetamine, Phendimetrazine, Dextroamphetamine, Luliconazole, Ethanol, Paroxetine, Ivacaftor, Mitotane, Metyrosine, Cathinone, Perampanel, Fosphenytoin, Cobicistat, St. John's Wort, Magnesium sulfate, Aprepitant, Tocilizumab, Stiripentol, Siltuximab, Azelastine, Minocycline, Orlistat, Sodium oxybate, Rufinamide, Rotigotine, Suvorexant, Lisdexamfetamine, Tapentadol, Paraldehyde, Buprenorphine, Deferasirox"
Amiloride,"Risperidone, Nalbuphine, Bupropion, Remifentanil, Fentanyl, Perindopril, Hydrocodone, Alfentanil, Hexobarbital, Eplerenone, Butorphanol, Tolvaptan, Phenelzine, Tapentadol, Molsidomine, Quinidine, Canagliflozin, Tacrolimus, Chlorpheniramine, Tadalafil, Nicorandil, Drospirenone, Obinutuzumab, Heptabarbital, Vardenafil, Acetylsalicylic acid, Yohimbine, Buprenorphine, Sufentanil, Ammonium chloride, Dihydrocodeine, Diazoxide, Primidone, Butobarbital, Levodopa, Pentazocine, Heparin, Oxymorphone, Moxonidine, Levorphanol, Pentoxifylline, Tranylcypromine, Amifostine"
Oxytetracycline,"Calcium carbonate, Iron sucrose, Tretinoin, Atracurium besylate, Zinc sulfate, Vecuronium, Zinc gluconate, Quinapril, Magnesium chloride, Colesevelam, Cholestyramine, Isotretinoin, Amoxicillin, Procaine benzylpenicillin, Aluminum hydroxide, Nafcillin, Rocuronium, Lanthanum carbonate, Magnesium oxide, Pancuronium, Ticarcillin, Cloxacillin, Acenocoumarol, Sodium bicarbonate, Mecamylamine, Calcium chloride, Magnesium hydroxide, Zinc, Bismuth subsalicylate, Warfarin, Magnesium salicylate, Mipomersen, Calcium gluconate, Clavulanic acid, Oxacillin, Magnesium sulfate, Calcium citrate, Magnesium citrate"
Ulobetasol,"Ceritinib, Deferasirox, Corticorelin ovine triflutate"
Labetalol,"Levonordefrin, Primidone, Dronedarone, Salmeterol, Phendimetrazine, Diazoxide, Butobarbital, Naphazoline, Cocaine, Vardenafil, Levodopa, Dobutamine, Lisdexamfetamine, Lacosamide, Tofacitinib, Articaine, Terbutaline, Epinephrine, Rivastigmine, Phenelzine, Racepinephrine, Methacholine, Regorafenib, Arformoterol, Ceritinib, Amiodarone, Benzphetamine, Hexobarbital, Propylhexedrine, Pirbuterol, Ruxolitinib, Floctafenine, Tadalafil, Nicorandil, Nifedipine, Metamfetamine, Oxymetazoline, Risperidone, Amifostine, Molsidomine, Obinutuzumab, Dyphylline, Salbutamol, Moxonidine, Olodaterol, Dexmethylphenidate, Iobenguane, Dopamine, Vilanterol, Tedizolid phosphate, Dipyridamole, Ivabradine, Pheniramine, Dihydrocodeine, Ephedrine, Heptabarbital, Chloroquine, Acepromazine, Tranylcypromine, Modafinil, Bretylium, Acetylsalicylic acid, Fingolimod, Isometheptene, Fenoterol, Acetylcholine, Yohimbine, Formoterol, Diethylpropion, Orciprenaline, Aminophylline, Armodafinil, Pseudoephedrine, Propafenone, Chlorpropamide, Pentoxifylline, Indacaterol, Mepivacaine, Sufentanil, Linezolid, Dextroamphetamine"
Thiopental,"Orlistat, Pipotiazine, Thioridazine, Aminophylline, Fluphenazine, Diazoxide, Perphenazine, Trifluoperazine, Ketamine"
